id_number,title_ch,authors_ch,institutions,funding,journal,journal_issue,keywords_ch,abstract_ch
397,同种异体肾移植术中的配合及护理,张颜; 于秀琴,清华大学第一附属医院,NA,现代中西医结合杂志; Modern Journal of Integrated Traditional Chinese and Western Medicine,2008年36期,肾移植; 手术配合; 术中护理,目的探讨同种异体肾移植手术的配合与术中管理方法。方法对10例肾移植患者术中配合和护理管理进行回顾性分析。结果所有患者术中未出现严重并发症，1例受者术后14个月因感染并肝功能衰竭死亡;另1例术后12 d因肺内出血致呼吸道梗阻死亡。结论充分做好术前准备，熟悉手术及用药配合，以及良好的术中护理对提高肾移植手术成功率起到积极的作用。
441,原位心脏移植3例(英文),刘季春; 徐建军; 万于华; 饶华庚; 王勤; 李志平; 刘升; 吴起才; 高涛; 陈干,南昌大学第一附属医院心胸外科; 南昌大学第二附属医院心胸外科,Supported by:Key Program of Ministry of Public Health of Jiangxi Province，No.20020206~~,中国组织工程研究与临床康复; Journal of Clinical Rehabilitative Tissue Engineering Research,2009年05期,心脏移植; 免疫抑制; 心肌保护; 器官移植,2001-08/2003-12南昌大学第一附属医院心胸外科分别为3例终末期心脏病患者进行了原位心脏移植，3例供者均为青年男性脑死亡者，供者与受者体质量差异均小于20%。3例受者均采用双腔静脉吻合法，移植后采用环孢素A、强的松及霉酚酸酯联合免疫抑制治疗。3例患者均顺利出院，心功能恢复至NYHAⅠ～Ⅱ级，围手术期无感染或严重排斥反应发生。提示良好的心肌保护、完善的围手术期处理以及合理的抗排斥治疗是心脏移植成功的关键。
315,改良胰液空肠引流式胰肾一期联合移植一例,徐友和; 明长生; 李香铁; 李慎勤; 张爱民; 刘仰东; 李明杰; 刘少鸽; 孙文杰,济南军区总医院泌尿外科; 华中科技大学同济医学院附属同济医院器官移植研究所; 济南军区总医院泌尿外科,NA,中华器官移植杂志; Chinese Journal of Organ Transplantation,2006年06期,胰液; 联合移植; 胰腺炎; 胰腺疾病,NA
167,原位肝脏移植术后肝动脉并发症的诊治,李澍; 朱继业; 栗光明; 朱凤雪; 申占龙; 王福顺; 彭吉润; 冷希圣,北京大学人民医院肝胆外科中心北京大学器官移植中心; 北京大学人民医院肝胆外科中心北京大学器官移植中心 100044; 100044,NA,中华外科杂志; Chinese Journal of Surgery,2004年17期,肝移植; 吻合术，外科; 手术后并发症; 肝动脉,目的　探讨肝脏移植术后肝动脉并发症的诊断和处理。方法　回顾性总结 10 7例肝脏移植患者的临床资料 ，分析肝脏移植手术中可能影响术后肝动脉并发症发生的危险因素 ，以及肝动脉并发症的预防、诊断和处理措施。结果　肝脏移植术后肝动脉并发症的发生与外科手术方式相关。供肝动脉的质量和供体 受体动脉的重建方式是两个重要因素。术后共发生动脉相关的并发症7例 ，发生率 6  5 4 % ;其中死亡 6例 ，死亡率 85  7% ;主要是肝动脉血栓形成和肝动脉狭窄。结论供肝动脉的质量和动脉的重建方式是影响术后肝动脉并发症发生的主要因素。早期诊断、早期治疗是处理肝动脉相关并发症 ，挽救植入器官和患者生命的关键
396,原位心脏移植治疗终末期心肌病七例,刘宇航; 周更须; 张闻辉; 刘建实; 沈中阳,天津市第一中心医院移植外科; 天津市第一中心医院移植外科; 天津市胸科医院,天津市科技发展计划项目(项目编号:05ZHTGCG00300),天津医药; Tianjin Medical Journal,2008年03期,心脏移植; 心肌疾病; 手术期间; 免疫耐受; 手术后并发症,目的:探讨心脏移植围手术期治疗的方法及疗效。方法:对7例终末期心肌病患者施行同种异体原位心脏移植术。前3例行标准Stanford原位心脏移植术，后4例行双腔静脉法原位心脏移植术。前2例采用达利珠单抗+霉酚酸酯诱导方案，后5例采用巴利昔单抗+霉酚酸酯诱导方案。术后均使用普乐可复(FK506)+骁悉(MMF)+泼尼松(Pred)三联免疫抑制剂。结果:1例术后出现血糖升高，给予胰岛素治疗后血糖恢复正常。3例术后早期出现急性肾功能衰竭，2例分别给予持续肾脏替代治疗(CRRT)后肾功能恢复正常，1例后因多器官功能衰竭死亡。6例存活患者均恢复正常工作和生活。结论:心脏移植是治疗终末期心肌病变有效的手段，完善的术前治疗、准确的手术时机把握、个体化的免疫抑制治疗应用、有效的血流动力学控制和及时的并发症处理可提高同种异体原位心脏移植术的疗效。
22,同种异体原位肝移植2例报告,顾元龙; 卞晋荣; 陶建中; 马荣赓; 沈安东; 陈布克; 何友钊; 吴小龙,无锡市第三人民医院!214041,NA,交通医学; Medical Journal of Communications,2001年02期,肝移植; 肝癌,目的 :探讨肝移植治疗肝癌的方法和效果。方法 :2 0 0 0年 6、9月对 2例原发性肝癌病人施行原位肝移植手术。结果 2例病人术后移植肝功能良好并存活至今 ，生活自理 ，能参加日常工作和体育锻炼 ，生活质量良好。结论 :原位全肝移植是治疗肝癌的有效方法之一。
140,同种异体肝移植手术的护理配合,孙秀芳,江苏省扬州市第一人民医院 江苏扬州225001,NA,齐鲁护理杂志; Journal of Qilu Nursing,2004年12期,肝; 移植; 手术; 护理,目的 :介绍同种异体肝移植手术的各项术前准备及术中护理配合。方法 :做好患者及术前准备工作 ，熟悉手术步骤及用物要求 ，术中密切观察配合。结果 :6例手术平均时长 9 3h ，3例患者健在 ，另外 3例生存时间分别为16 0d、 7d、 4d。结论 :做好充分术前准备 ，术中严密监测 ，医护默契配合 ，可为手术成功创造条件
510,热缺血期通气对大鼠无心跳供肺的作用,郭卫刚; 谭黎杰; 王群; 薛亮; 徐松涛,复旦大学附属中山医院胸外科,上海市重点学科建设项目(编号:B116);复旦大学青年基金(编号:08-278),中国临床医学; Chinese Journal of Clinical Medicine,2012年02期,肺移植; 无心跳供肺; 缺血再灌注损伤; 通气; 热缺血时间,目的:探讨大鼠肺移植手术中，心脏停跳后热缺血期通气对大鼠无心跳供肺的影响。方法:雄性Sprague-Dawley(SD)大鼠64只，按供体鼠体质量稍轻于受体鼠的原则，将其随机配成32对。将32对大鼠随机分为热缺血3h不通气组(warm is-chemia with non-ventilation，WNV组)和热缺血3h并机械通气3h组(warm ischemia with ventilation，WV组)2组，每组16对;每组大鼠根据再灌注时间，分为再灌注2h亚组和再灌注24h亚组，每亚组8对。建立大鼠无心跳供肺移植模型，再灌注2h或24h后对移植肺进行血气分析并处死大鼠，取其肺组织，检测肺湿干质量比、肺损伤病理评分、细胞凋亡等指标并在电镜下观察细胞超微结构。结果:左肺静脉的氧分压(PaO2)在WNV组和WV组的2个再灌注2h亚组之间以及2个再灌注24h亚组之间均有显著差异(P<0.05)，右颈动脉PaO2仅在2个再灌注24h亚组之间有显著差异(P<0.05);左肺湿干质量比和光镜形态学病理损伤评分在2个再灌注24h亚组之间均有显著差异(P<0.05);细胞凋亡指数在2个再灌注2h亚组之间有显著差异(P<0.05);电镜观察显示WV组细胞超微结构的损伤较WNV组轻。结论:热缺血期通气能够改善大鼠无心跳供肺移植缺血再灌注肺损伤，提示无心跳供肺热缺血时间在低温且肝素化通气状况下可达3h。
112,小鼠异位心脏移植模型的建立,吴蔚; 杨康; 姜恒,第三军医大学西南医院胸心外科; 第三军医大学西南医院胸心外科 重庆400038; 重庆400038; 重庆400038,NA,重庆医学; Chongqing Medical Journal,2004年12期,小鼠; 心脏; 异位移植,目的　为方便现代移植免疫学研究 ，我们建立了小鼠异位心脏移植模型 ，为今后的器官移植研究打下基础。方法　以C5 7小鼠为受体 ，Balb/c小鼠为供体 ，参照Ono法并加以改良 ，将供体升主动脉、肺动脉与受体腹主动脉和下腔静脉行端侧连续吻合。结果　正式试验 2 5次 ，4例在 72h以内死亡 ，其余 2 1例均长期存活 ，手术成功率为 84 %。结论　在熟练掌握显微外科技术的基础上 ，处理好心脏移植的 5个关键步骤 ，小鼠异位心脏移植模型即可顺利建立。
293,首例同种异体肺移植供肺摘取配合体会,罗新玲; 邵丽,新疆医科大第一附属医院中心手术室; 新疆医科大第一附属医院中心手术室 新疆乌鲁木齐830054; 新疆乌鲁木齐830054,NA,新疆医科大学学报; Journal of Xinjiang Medical University,2006年04期,配合体会; 手术间; 肺移植手术; 首例; 保温箱; 棉垫; 灌注液,<正>肺移植手术已经成为临床终末期肺疾病有效的治疗手段之一。我院于2005年4月11日成功地完成了首例同种异体肺移植手术，病人目前情况良好，现将供肺摘取配合体会介绍如下。 1 供肺选择本例供肺选择符合文献[2]标准，年龄<50岁，胸片正常，ABO血型匹配，PaO2>300 mmHg，纤维支气管镜检查无脓性分泌物或误吸，既往胸部无手术史。供肺体积不超过受体肺的1．5倍。
174,心脏移植供心的心肌保护研究,孙云; 严中亚; 吴一军; 雷虹; 卢中; 郑理; 程光存; 宋小蓉,安徽省立医院心脏外科; 安徽省立医院心脏外科 230001 合肥; 230001 合肥,NA,安徽医学; Anhui Medical Journal,2005年06期,心脏移植; 供心; 低温; 冷晶停搏; UW液,目的总结4例心脏移植的供心保护经验。方法缩短热缺血时间，切除供心时先以冷晶停跳液500 ml灌注，使供心迅速停搏，心包内放入冰屑使供心降温，切除供心后，再灌注0-4℃UW保存液1000 ml(6-8分钟灌注完)，用浸泡法低温保存供心，4例供心热缺血时间分别为3、4、6、6分钟，冷缺血时间分别为220、415、215、226分钟。结果升主动脉开放后，3例自动复跳，1例电击除颤后复跳，围手术期供心功能良好，术后患者康复顺利，现心功能均为Ⅰ级。结论用此方法可使供心得到良好的心肌保护。
534,肝移植后的并发症,余忠山; 江艺; 蔡秋程; 杨芳; 吕立志,福建医科大学福总临床医学院; 全军器官移植中心，解放军南京军区福州总医院肝胆病中心,福建省自然基金重点项目(2011Y0046)，课题名称:肝移植术后感染状态下细胞免疫功能的实验及临床研究;军区医学科技创新重点课题(11Z033)，课题名称:拯救性肝移植的临床和基础研究~~,中国组织工程研究; Chinese Journal of Tissue Engineering Research,2013年18期,器官移植; 肝移植; 围手术期; 并发症; Child-Pugh分级; 血清胆红素; 血清白蛋白; 凝血酶原时间; 肝性脑病; 省级基金,背景:原位肝移植因其移植过程复杂，易产生各种并发症，制约着肝移植手术的成功率。目的:分析肝移植后并发症发生的常见原因及预防处理措施。方法:回顾性分析176例肝移植患者中出现并发症的59例患者的临床资料，男53例，女6例，年龄25-74岁，平均(46.41±12.02)岁。原发病中乙型肝炎后肝硬化10例(合并肾衰1例)，肝硬化合并肝细胞性癌7例，胆汁性肝硬化4例，酒精性肝硬化1例，肝细胞性癌13例，胆管细胞癌1例，肝豆状核变性3例，肝功能衰竭13例，重型乙型病毒性肝炎7例(合并肾衰1例)。所有病例供、受者均符合血型相符原则。结果与结论:肝移植后发生并发症102例次，其中腹腔内出血15例，上消化道出血5例，肺部感染21例，腹腔感染5例，胆道并发症21例，慢性排斥3例，急性排斥10例，急性肾功能衰竭7例，乙肝复发3例，神经精神并发症6例，移植肝无功能4例，下腔静脉血栓形成、移植物抗宿主反应各1例。围手术期死亡24人，直接死亡原因腹腔出血6例，肺部感染6例，移植肝无功能4例，多器官功能衰竭3例，腹腔感染、移植物抗宿主、心脏骤停、胆管坏死、蛛网膜下腔出血各1例。提示重视肝移植患者围移植期的处理，改善肝功能、纠正凝血障碍、改善营养、控制感染，重视移植技术的完善和并发症的及时诊断处理，是提高肝移植成功率的关键。
329,原位肝脏移植术后胆道并发症的防治(附81例报告),李光兵; 刘军; 杨凤辉; 许世峰; 周旭; 公伟,山东省立医院器官移植中心; 山东省立医院器官移植中心 济南250021; 济南250021,山东省中青年科学家奖励基金(项目编号2005BS03006),肝胆外科杂志; Journal of Hepatobiliary Surgery,2007年03期,肝脏; 移植,NA
137,原位肝移植5例报告,虞磊; 李建平; 胡明华; 金慧涵; 竺来法; 戴途,南京医科大学附属无锡市第二人民医院肝胆外科; 南京医科大学附属无锡市第二人民医院肝胆外科 无锡214002; 无锡214002; 无锡214002,NA,南通医学院学报; Journal of Nantong Medical,2004年01期,原位肝移植术; 肝硬化; 原发性肝细胞癌,NA
171,原位心脏移植56例的临床经验,王春生; 陈昊; 洪涛; 赵强; 丁文军; 王宜青; 宋凯; 赖颢; 赵东; 杨守国,复旦大学附属中山医院上海市心血管病研究所复旦大学器官移植中心心外科; 复旦大学附属中山医院上海市心血管病研究所复旦大学器官移植中心心外科 200032; 200032,NA,中华医学杂志; National Medical Journal of China,2004年19期,心脏移植; 免疫抑制; 治疗结果,目的　总结分析复旦大学器官移植中心 5 6例原位心脏移植的临床经验。方法　 2 0 0 0年 5月至 2 0 0 3年 12月连续为 5 6例患者行原位心脏移植术 ，包括扩张型心肌病 4 7例 ，终末期瓣膜性心肌病 2例 ，终末期缺血性心肌病 2例 ，原发性心脏恶性肿瘤 2例 ，复杂先天性心脏病 1例 ，肌营养不良性心肌病 1例 ，恶性心律失常 1例。手术按标准法行原位心脏移植手术 19例 ，双腔静脉吻合法移植手术 37例。术后抗排斥反应治疗采用环孢素 +泼尼松 +霉酚酸酯三联方案。结果　手术死亡1例 ，死因为第 5次手术术后渗血不止。所有存活病例获完整随访 ，在平均 12 .4个月的随访中 ，术后1年内死亡 5例 ，1年存活率 91% ，其中死于肾功能衰竭 1例 ，慢性右心衰 1例 ，急性排斥反应 2例 ，车祸 1例。 1例术后 3年 2个月死于移植物冠状动脉硬化。存活病例心功能恢复至ⅠⅡ级。结论通过选择适当的受体病例 ，保护良好的心肌 ，采用双腔静脉吻合技术 ，加强术后监测与预防多种并发症 ，心脏移植可获得满意的早中期疗效。
399,肝移植术后胆道并发症33例分析,金海龙; 石炳毅; 杜国盛; 戴新; 宋继勇; 朱志东; 王爽,解放军总医院第二附属医院全军器官移植中心; 解放军总医院第二附属医院全军器官移植中心 北京市100091; 北京市100091,军队“十一五”科技攻关资助课题(06G115)~~,中国组织工程研究与临床康复; Journal of Clinical Rehabilitative Tissue Engineering Research,2008年05期,肝移植; 手术后并发症; 胆道疾病,目的:胆道并发症是肝移植术后常见的并发症，严重影响肝移植患者的生存率和生活质量。课题拟进一步明晰认识肝移植术后胆道并发症的病因并确立早期防治措施。方法:①对象:解放军总医院第二附属医院全军器官移植中心于2002-04/2007-09完成的254例原位肝移植患者中，术后发生胆道并发症者33例，回顾分析患者的临床资料。②方法:胆管重建方式为胆总管端端吻合术。并发胆漏者，予置管充分引流;吻合口狭窄者经皮肝穿刺胆道造影或经内镜逆行胰胆管造影球囊扩张术，必要时放置胆道支架;非吻合口狭窄者行经皮肝穿刺胆道造影联合胆道镜治疗，严重者行二次肝移植术。结果:18例胆漏患者均通过腹腔引流、鼻胆管引流治愈;9例吻合口狭窄患者经内镜逆行胰胆管造影或经皮肝穿刺胆道造影球囊扩张术治愈，其中3例放置了胆道支架;6例非吻合口狭窄患者中，2例经皮肝穿刺胆道造影联合胆道镜治疗后痊愈，2例接受了二次肝移植，2例恢复不佳。结论:改进手术方法、缩短移植物冷热缺血时间及保护胆管血供可降低肝移植术后胆道并发症的发生，治疗的关键在于早期诊断、合理选择治疗方法，处理得当患者可长期存活。
492,心肺移植供体心肺保护1例,陈涛; 毕生辉; 程亮; 王红兵; 俞世强; 刘金成; 金振晓,第四军医大学西京医院心血管外科,NA,心脏杂志; Chinese Heart Journal,2011年05期,艾森门格综合征; 心肺移植; 器官保存,<正>同种异体心肺联合移植是目前治疗各种原因引起的晚期心肺疾病效果最好的方法之一[1]。近年来，随着外科技术水平的提高，供体心肺保护技术及新的免疫抑制剂的应用，心肺联合移植手术在我国少数大型心脏外科中心得到开展。心肺联合移植供体心肺的获取及保护效果无疑是手术能否
15,大鼠异位心脏移植模型的改进,陈建锋; 高毅; 孙尔维; 汪爽,第一军医大学珠江医院器官移植科!广东 广州 510282,国家自然科学基金（39870724，39970705）,第一军医大学学报; Journal of First Military Medical University,2001年09期,心脏移植; 模型; 解剖学,目的 改进制作大鼠心脏移植模型的方法。方法 在陈忠华术式的基础上加以改进，用含肝素的冰生理盐水自下腔静脉直接灌注；采用腹腔异位移植方法，将供心主动脉和肺动脉分别与受者的腹主动脉和下腔静脉端侧吻合，以长哈巴狗夹代替两个弯血管夹。结果 72例大鼠心脏移植手术成功率提高到90%以上，手术时间缩短为70 min。 结论 采用作者所改进的方法能提高手术成功率，缩短手术时间。
286,提高供肝灌注切取质量减少肝移植手术后胆道损伤并发症,刘煜; 王建立; 吴凤东; 关兆杰; 范宁,武警总医院肝移植研究所; 武警总医院肝移植研究所 北京 100039; 北京 100039,NA,武警医学院学报; Acta Academiae Medicinae CPAPF,2006年05期,肝移植; 胆道并发症; 器官获取; 器官修剪,[目的]探讨肝移植术供肝的灌注、切取和修整方法，以进一步减少肝移植手术后胆道损伤并发症。[方法]总结分析2002年5月-2005年5月采用不同方法快速原位灌注、快速切取以及修剪的437例供肝。[结果]437例供肝无1例原发肝脏无功能发生，但67例患者发生轻重不同的胆道损伤并发症，其中3例患者行二次肝移植治愈，其他患者行胆道引流和胆道镜治疗治愈或好转。[结论]合理的供肝灌注、切取和修剪，可有效的减少肝移植手术后胆道损伤并发症。
113,心脏移植的体外循环1例报告,付海花; 唐振山; 段梅红,长治医学院附属和平医院麻醉科; 长治医学院附属和平医院麻醉科 046000; 046000; 046000,NA,长治医学院学报; Journal of Changzhi Medical College,2004年01期,心脏; 移植; 体外循环,目的 :探讨心脏移植术体外循环心肌保护 ，血液成份保护及预防排斥反应等问题。方法 :对体外循环下同种异体原位心脏移植患者的临床资料进行总结分析。结果 :采用标准法对该例患者进行原位心脏移植 ，供心热缺血时间为 1 0min ，冷缺血时间为 1 0 5min ，总体外循环时间为 1 2 8min。升主动脉阻断时间为 64min。患者已存活 60d。术后患者无排斥反应 ，感染 ，心及肝肾功能不全等并发症。结论 :良好的心肌保护 ，血液成分保护 ，体外循环过程预防排斥反应及完善的体外循环操作技巧是心脏移植成功的关键。
410,脑死亡无偿器官捐献心脏移植二例,陈良万; 陈道中; 戴炳光; 曲崎; 郭尚耘; 邱罕凡; 吴锡阶; 王增春,福建医科大学附属协和医院心外科; 济南市第四人民医院心外科; 福建医科大学附属协和医院心外科 350001福州市; 350001福州市,NA,中国心血管病研究; Chinese Journal of Cardiovascular Review,2008年02期,供心; 脑死亡; 心脏移植,目的探讨脑死亡无偿器官捐献心脏移植在我国的可行性及保证手术成功的必要条件。方法分别于2006年7月1日和2006年8月16日完成二例脑死亡无偿器官捐献心脏移植。供体确诊为脑死亡后应用小剂量多巴胺维持稳定的血流动力学和满意尿量，维持良好的电解质酸碱平衡、血气交换和血球压积而没有明显心源性肺水肿。供、受体ABO血型一致，但例1供、受体体重相差50%。结果例1于术后第3天死于低心排综合征;例2痊愈出院，现已从事正常工作，生活质量良好。结论脑死亡无偿器官捐献心脏移植在我国可以得到开展;脑死亡患者必须有满意的血流动力学和尿量及良好的心脏收缩功能才能作为理想的心脏移植供体;供受体间体重相差不应超过20%。
362,肝移植供肝修整的经验,叶少军; 明英姿; 叶启发; 刘雄友; 黄湘华,中南大学湘雅移植医学研究院、中南大学湘雅三医院; 中南大学湘雅移植医学研究院、中南大学湘雅三医院 湖南长沙410013; 湖南长沙410013,卫生部部属临床重点学科项目(98040362),中国普通外科杂志; Chinese Journal of General Surgery,2007年03期,肝移植; 供肝修整; 手术后并发症/预防与控制,目的探讨肝移植供肝修整的方法与技巧。方法回顾性分析64例原位肝移植供肝修整以及血管变异时处理的方法和技巧。结果修整的64例供肝全部用于肝移植。发现13例存在肝动脉解剖变异，其中5例行变异肝动脉重建，动脉重建方法包括将变异动脉与脾动脉(3/5)、胃十二指肠动脉(2/5)吻合。无因供肝修整而出现的手术并发症。结论供肝血管及胆道的正确修整可减少肝移植后并发症，是供肝修整成败的关键。
14,原位心脏移植手术的体外循环管理,刘亚湘; 毛向辉; 吴华; 邹小明; 王武军; 杨锡耀,第一军医大学南方医院胸心外科!广东  广州  510515; 第一军医大学南?,NA,第一军医大学学报; Journal of First Military Medical University,2001年08期,心脏移植; 体外循环,NA
148,心脏移植1例报告,吴吉明; 易华文; 魏尚典; 潘道波; 钟发平; 方莉; 陈德祥,湖南省常德市第一人民医院胸外科,NA,中国现代手术学杂志; Chinese Journal of Modern Operative Surgery,2004年06期,心脏移植,NA
50,论脑死亡立法的生物医学基础、社会学意义及推动程序,陈忠华,华中科技大学同济医学院同济医院器官移植研究所 湖北武汉430030,NA,医学与哲学; Medicine and Philosophy,2002年05期,脑死亡法; 弥漫性; 判定标准; 脑干死亡; 大脑皮质; 生物医学; 社会学意义; 程序,NA
454,原位肝移植术后肝脓肿的原因和处理,韩明; 何晓顺; 马毅; 王东平; 鞠卫强; 巫林伟; 胡安斌; 邰强; 朱晓峰; 黄洁夫,中山大学附属第一医院器官移植中心,NA,中国普通外科杂志; Chinese Journal of General Surgery,2009年07期,肝移植/副作用; 肝脓肿/并发症; 肝脓肿/治疗,目的探讨原位肝移植术(OLT)后肝脓肿的病因及治疗选择。方法分析4年间行OLT558例术后1～18个月发生肝脓肿10例(1.8%)的原因。结果7例为术后胆道并发症，2例为肝癌复发灶射频消融术(RFA)后，1例为不明原因感染。主要临床表现有发热、肝功能损害、低蛋白血症和贫血等。诊断主要根据临床表现及超声或CT检查。治疗方法主要包括脓肿抽吸引流、PTCD胆道内外引流、抗感染和支持治疗及再次肝移植。10例中6例通过肝脏穿刺引流治愈，2例通过再次肝移植治愈，2例死于脓毒血症;治愈率为80.0%。结论OLT后发生肝脓肿地原因复杂，可能与胆管吻合口狭窄或梗阻、胆道缺血坏死、肝癌复发灶介入治疗、肝动脉血栓或狭窄和激素冲击治疗等有关。OLT后肝脓肿的预后较差，早期诊断和治疗是关键。
4,同种异体心脏移植长期存活(附1例报告),邹小明; 王武军; 张振,第一军医大学南方医院心胸外科!广东 广州 510515,NA,第一军医大学学报; Journal of First Military Medical University,2000年05期,心脏移植术; 同种异体; 免疫抑制; 排斥反应,目的 介绍我院首例同种异体原位心脏移植术的围手术期处理及排斥反应监测、治疗经验。方法 切取供体（24岁男性脑死亡者）心脏并原位移植给受体（43岁女性终末期扩张性心肌病患者），并在术后进行严格的监护治疗和随防。供心手术历时50 min，移植心脏热缺血时间为0 min，冷缺血时间为70 min；受体手术历时290 min，体外循环总时间123 min，主动脉阻断73 min。术后采用FK 506，骁悉及泼尼松行免疫抑制治疗，同时用彩色多普勒超声心动图监测排斥反应。结果 患者现已健康生存160 d，心、肝、肾功能正常。结论 心脏移植是治疗终末期心脏病的最有效方法，术后处理是确保心脏移植成功的关键。
