id_number,title_ch,authors_ch,institutions,funding,journal,journal_issue,keywords_ch,abstract_ch
361,大鼠心跳停搏供肝在原位肝移植术中损伤的预防,邵堂雷; 杨卫平; 彭承宏; 蔡伟耀; 李宏为,上海交通大学附属瑞金医院外科; 上海交通大学附属瑞金医院外科 上海200025; 上海200025,NA,中国普通外科杂志; Chinese Journal of General Surgery,2007年03期,肝移植; 供体; 心脏停博; 供肝损伤/预防与控制,目的探讨预防和减轻大鼠心跳停搏供肝在原位肝移植术中的损伤，以提高手术成功率。方法雄性SD大鼠随机分为心跳停搏热缺血30min(N-30)和45min(N-45)两组;，每组分别行原位肝移植术30只次。同时，根据是否对供体手术方法进行改进又分为常规组和改良组。结果(1)常规组和改良组的冷缺血时间分别为(70.04±1.48)和(70.36±1.42)min(P>0.05)，无肝期均为(16.40±0.73)min，肝下下腔静脉阻断时间均为(22.75±1.16)min，受体手术时间均为(90.58±3.76)min。(2)N-30和N-45常规组分别有5和9只受体术后死于原发性移植肝无功能，而改良组仅为1和2只(40%∶12%，P<0.05);(3)N-30和N-45组因术中分别出现供肝损伤致再灌注后供肝大量渗血、无肝期过长、切除受体肝脏时麻醉过深，而各有5和7，2和1，2和2只受体术后死亡。(4)N-30和N-45组术后1周存活率分别为50%和30%(P<0.05)。结论预防心跳停搏供肝游离时损伤、供肝再灌注后渗血、无肝期过长和切除受体肝脏时麻醉过深是大鼠心跳停搏供肝原位肝移植手术成功的关键。
518,心死亡遗体器官捐献的伦理思考及实践探究,姚瑶,天津医科大学医学人文学院,NA,医学与哲学(A); Medicine & Philosophy,2012年06期,心死亡; 器官捐献; 伦理问题,在简述心死亡器官捐献概念及我国进展基础上，分析本土文化中个体、家庭与社会三者价值制衡对心死亡遗体器官捐献(Donation of Cardiac Death，DCD)捐献的阻碍;深掘本土伦理价值中超越死亡、追求价值统一、生命意义是DCD发展的动力源泉;提出启发人们内在价值追求同时辅助伦理原则与法律规范是DCD行之有效地实践方法。
627,腹主动脉联合门静脉快速灌注法在器官捐献供体肝肾联合获取中的应用,邓斐文; 陈焕伟; 甄作均; 王峰杰; 李杰原; 胡健垣; 计勇,广东佛山市第一人民医院肝脏胰腺外科,广东省医学科研基金(A2014697);佛山市医学类科技攻关项目(2014AB00263);佛山市卫生局医学科研基金(2014029),器官移植; Organ Transplantation,2015年01期,器官捐献; 腹主动脉插管灌注; 门静脉灌注; 肝肾联合获取,目的总结腹主动脉联合门静脉快速灌注法在器官捐献供体肝肾联合获取中的可行性和安全性。方法回顾性分析2011年9月至2014年6月在佛山市第一人民医院完成的43例中国心脏死亡供体器官捐献肝肾联合获取的临床资料。43例供体中，中国心脏死亡供体分类一类(脑死亡供体)(C-Ⅰ类)15例，中国二类(心脏死亡供体)(C-Ⅱ类)1例，中国三类(脑-心双死亡捐献供体)(C-Ⅲ类)27例。器官灌注采用腹主动脉、门静脉快速插管联合灌注法。结果开腹至腹主动脉插管时间约1.5~2.0 min，43例供体共获得肝脏43个，肾脏86个。C-Ⅰ类供体热缺血时间全部为0，其余供体热缺血时间范围为3~21 min，平均10 min。2例供肝分别因肝门部严重损伤和重度脂肪肝弃用，18例供肾分别因肾结石、肾萎缩、术前血清肌酐水平较高、肾动脉粥样硬化严重、肾微小血管血栓、多发肾囊肿、外伤性肾破裂等原因弃用，供体器官总弃用率为16%。结论腹主动脉联合门静脉快速灌注法是器官捐献供体肝肾联合获取的简单、安全的方法。
270,同种异体肝移植围手术期的处理,袁伟升; 王志远; 刘鹏; 张华; 刁同进; 郑秀海; 宫琳,401医院肝胆外科; 401医院肝胆外科 山东青岛266071; 山东青岛266071,NA,实用医药杂志; Practical Journal of Medicine & Pharmacy,2006年04期,肝移植; 围手术期; 手术并发症,目的总结肝移植围手术期处理的经验。方法对34例肝移植临床资料进行回顾性分析。结果34例患者手术成功率100%;围手术期病死2例，围手术期病死率为5.9%。术后围手术期共发生并发症40例次。结论完善的手术技术，围手术期的严密监测及并发症的处理是肝移植成功的重要条件。
18,心脏移植术后抗排斥反应治疗,王武军; 张振; 邹小明,第一军医大学南方医院胸外科!广州510515,NA,广东医学; Guangdong Medical Journal,2001年05期,心脏移植; 免疫抑制治疗; 副作用,目的　研究新三联免疫抑制方案在心脏移植中的应用及其副作用。方法　为 1例扩张性心肌病患者进行了同种异体原位心脏移植手术 ，术后采用骁悉 (MMF)、普乐可复 (FK5 0 6 )、强的松 (Pred)三联免疫抑制剂进行抗排斥反应治疗。结果　患者术后恢复平稳 ，心内膜心肌活检未发现排斥反应 ，其主要副作用是胃肠道反应和轻度骨髓抑制。结论　新三联免疫抑制治疗方案在心脏移植中能有效地抑制移植后急性排斥反应的发生。
595,脑死亡的确定,张玉芝,NA,NA,国外医学.护理学分册,1999年10期,脑死亡; 概念; 思维形式; 患者家属; 确诊试验,NA
415,腹部多器官联合移植供器官切取方法探讨,于立新; 叶俊生; 徐健; 付绍杰; 杜传福; 邓文锋; 王亦斌; 余玉明; 魏强; 李川江,南方医科大学附属南方医院器官移植科,NA,中国临床解剖学杂志; Chinese Journal of Clinical Anatomy,2008年05期,多器官联合切取; 肝移植; 肾移植; 胰腺移植; 联合移植,目的:总结腹部多器官联合移植供器官的切取方法，观察其临床应用效果。方法:1999～2006年共行肝肾联合移植18例，肝胰联合移植1例，胰肾联合移植6例，均采用腹部多器官联合切取技术，优先灌注腹主动脉，于小肠系膜根部分离肠系膜上静脉，插管灌注肝门静脉，整块切取肝、脾、肾、以及胰腺和部分十二指肠。结果:腹腔多器官联合切取时间为(16.0±3.0)min，热缺血时间(3±1.2)min，所有供器官、血管无损伤，灌注良好。术后移植物功能恢复顺利，无移植肝原发无功能发生，无严重胆道并发症发生。肝肾联合移植患者术后ALT恢复正常时间为(8±3.2)d，Scr恢复正常时间为(6±2.8)d)。肝胰联合移植患者1周内ALT恢复正常并脱离胰岛素治疗。胰肾联合移植患者术后1周内脱离胰岛素治疗，2周内Scr功能恢复正常。所有患者随访至今，存活1～7年，移植物功能正常。结论:采用尸体腹部多器官联合切取技术能快速优质切取肝、脾、肾、以及胰腺和部分十二指肠，缩短热缺血时间，减少动脉损伤，提高腹部多器官联合移植存活。
334,无心跳供者心脏热缺血及冷保存过程中心肌活性的检测,段贵新; 广濑一; 景华; 罗立国; 胡小南; 李德闽; 李中东; 顾卫东; 许飚; 易俊,南京军区南京总医院心胸外科; 日本国岐阜大学脏器病态学讲座高度先进外科; 南京军区南京总医院心胸外科 江苏南京210002; 分野岐阜500日本; 江苏南京210002,江苏省博士后科研基金资助项目(批准号:2004160),医学研究生学报; Journal of Medical Postgraduates,2007年03期,介电特性; 心肌硬度; 心肌活性; 无心跳供心,目的:探索一种简单而且迅速地检测无心跳心肌活性的方法，对热缺血和冷保存过程中无心跳心肌介电特性和心肌硬度的变化进行探讨。方法:杂种小猪随机分成对照组和实验组，呼吸机停止前15min，分别静注等渗盐水及前列腺素E1(PGE1)。窒息诱导心脏停跳，供者心暴露在室温下25°C 20min，然后低温保存60min。用电生理分析仪和超声波硬度计分别测定介电特性指标tanδm和心肌硬度ΔF，并计算Δtanδm和ΔΔF(Δtanδm定义为某一时刻的tanδm减去测定开始时的tanδm，ΔΔF定义为某一时刻的ΔF减去测定开始时的ΔF)。结果:对照组的tanδm逐渐减少，而实验组的tanδm在热缺血7min后出现一过性峰值，然后逐渐下降。实验组Δtanδm值高于对照组(P<0.001)。实验组ΔΔF值低于对照组(P<0.001)。结论:Δtanδm和ΔΔF之间有明显的相关关系。结果提示硬度指标可以用来评价无心跳心肌活性。同时也证明PGE1对心肌有保护作用。
108,活体肝移植术后并发症的处理,管文贤; 窦科峰; 李开宗; 刘正才,第四军医大学西京医院肝胆外科; 第四军医大学西京医院肝胆外科 西安 710032); 西安 710032); 西安 710032),NA,中国现代医学杂志; China Journal of Modern Medicine,2003年19期,肝移植; 手术; 并发症,目的:探讨活体肝移植术后并发症的处理方法。方法:介绍3例活体肝移植患者术后出现的腹腔出血、急性排斥反应、胸腹水、肺不张、口腔黏膜病变、切口裂开、肝动脉栓塞、胆漏等并发症的处理经过及结果。结果:3例患者均成功处理了各种并发症，例1已健康生存4年6个月;例2已健康生存1年7个月;例3已健康生存9个月。结论:活体肝移植术后腹腔内出血发生率较高，常需要再次开腹止血;胸腹水、肺不张、切口裂开、口腔黏膜病变等并发症采用常规措施多能获得控制;急性排斥反应经激素冲击治疗多有效;超声多普勒检查是及时诊断肝动脉栓塞的良好方法，治疗时不宜采用αPTA;长期的利胆治疗有利于防止胆道并发症。
403,袖片技术在成人肝移植动脉重建中的应用,易滨; 于勇; 罗祥基; 谭蔚锋; 姜小清; 张柏和; 吴孟超,解放军第二军医大学东方肝胆外科医院胆道一科,NA,中国组织工程研究与临床康复; Journal of Clinical Rehabilitative Tissue Engineering Research,2008年31期,袖片技术; 肝移植; 肝动脉; 修复外科,背景:血管重建和端口吻合是临床肝移植的难点，将袖片技术应用于肝移植动脉重建，对扩大吻合口径、减少动脉血栓形成、促进移植物及受体长期存活具有重要意义。目的:分析袖片技术在全肝移植前供体间动脉重建和植入时供受体动脉重建的吻合部位，探讨动脉袖片技术的应用条件。设计、时间及地点:单中心抽样，回顾性病例分析，于2004-03/2006-07在解放军第二军医大学东方肝胆外科医院完成。对象:选取解放军第二军医大学东方肝胆外科医院单个医疗组同期收治的接受肝移植患者80例，供体均为脑死亡男性志愿捐献者，供受体ABO血型相合。方法:后台完成供体间动脉重建，尽量保留、重建全部供肝变异、受损伤动脉。植入时完成供受体重建，主要选用粗大且直径匹配的供受体动脉。选择动脉端或应用袖片技术进行动脉吻合，尽量通过单个吻合完成重建。通过修剪供体或受体动脉，获取吻合端的动脉分支或根部袖片。主要观察指标:统计植入前供肝动脉重建的远、近心端及植入时供受体重建的供、受体侧4个位置的吻合部位分布、袖片应用率、吻合口径。结果:植入前后台供肝动脉吻合11例(吻合口12个)，其中10例来自肠系膜上动脉的迷走右肝动脉进行了后台重建;在吻合口远心端，迷走右肝动脉根部袖片吻合口直径明显大于其端口(t=5.423，P<0.01);在吻合口近心端，吻合部位以脾动脉端最常用(7/12)，吻合口直径为(4.4±1.8)mm。植入时供受体肝动脉吻合80例，供体侧以肝总动脉分支袖片、腹腔动脉端和肝固有动脉分支袖片最常用，构成比分别为57.50%，16.25%，8.75%;吻合口径基本相似(P>0.05);受体侧以肝总动脉分支袖片和肝固有动脉分支袖片最多，构成比分别为60.00%，27.50%，前者吻合口径明显大于后者(P<0.01)。植入前吻合的袖片应用率明显低于植入时吻合(χ2=30.799，P<0.01)，植入前供肝动脉重建的远、近心端及植入时动脉重建的供、受体侧其袖片应用率分别为41.7%，0，70.0%和92.5%，仅植入前供体远心端与植入时供体侧组比较基本相似(P>0.05)，余部位两两比较差异有显著性意义(χ2=13.292~51.004，P<0.01)。结论:在供肝动脉植入前进行后台重建时，采用袖片技术的迷走右肝动脉可获得比动脉端更大的吻合口径。植入时供受体动脉重建的袖片应用率高于植入前供体动脉重建，且植入时动脉重建的受体侧均采用分支袖片的肝总动脉能够获得比肝固有动脉更大的吻合口径。
552,脑死的放射学诊断及其病理学基础,祁吉; 吴恩惠,天津医学院附属医院放射科; 天津医学院附属医院放射科,NA,国外医学(临床放射学分册),1981年04期,脑血循环; 不可逆性; 衰减值; 灰质; 脑血管造影; 放射学诊断; 椎动脉造影; 颅内血管; 脑血流; 病理学; 基础医学,<正> 已知在一些重度颅脑损伤、颅内肿瘤或脑出血病例中，脑血管造影可见脑血流停滞现象，称全脑梗塞或脑死。也有称人脑死综合征、皮质死亡、缺氧性全脑脑病、人工呼吸器脑和不可逆性昏迷者。脑死的放射学诊断一、脑血管造影通过脑血管造影观察脑血循环停滞是诊断脑死的最早、最可靠的手段。1953年Rii-hede 第一次报告5例颅内压增高病人脑血
314,原位心脏移植五例报告,解强; 杨智翔; 应朝辉; 汤义; 吕树梁,大连大学附属新华医院心脏外科; 大连大学附属新华医院心脏外科 116021; 116021,NA,中华器官移植杂志; Chinese Journal of Organ Transplantation,2006年06期,心脏移植; 受者; 波振幅; 术前; 心脏移植术; 心肌内心电图,NA
322,双线静脉延长法延长右侧供肾静脉142只分析,韩健乐; 陈潜; 陈鑫; 王长安; 韩林; 刘永生; 杨青彦,河南省郑州市第七人民医院泌尿科; 河南省郑州市第七人民医院泌尿科 450006; 450006,NA,中国误诊学杂志; Chinese Journal of Misdiagnostics,2006年11期,肾移植; 修复外科手术,NA
51,40例临床肝移植血管和胆管重建经验,董家鸿; 王曙光; 别平; 王槐志; 杨占宇; 何宇; 李智华; 蔡景修,第三军医大学西南医院全军肝胆外科研究所; 第三军医大学西南医院?,NA,中华肝脏病杂志; Chinese Journal of Hepatology,2002年01期,肝移植; 血管重建; 胆管重建,目的 总结第三军医大学西南医院肝移植时血管及胆管重建的经验。方法 回顾性分析４０％肝移植时血管重建、胆道重建的方法及效果。结果 本研究肝移植病例围手术期死亡６例，手术病死率为１５．０％。并发症为：肺部感染１８例；多器官功能衰竭５例；腹腔内出血４例；ＡＲＤＳ ８例；肝动脉血栓形成１例；胆漏１例；脑出血１例。存活最长的１例为３１个月，有１５例生存期超过１年。结论 良好的血管和胆管重建技术是确保肝移植手术成功的关键。
218,大鼠腹腔内心脏移植模型的建立,刘小村; 张百萌; 熊宇; 李涌,福建医科大学; 厦门市中山医院; 厦门市中山医院 2002级研究生; 厦门 福建 361004,厦门大学科技创新基金资助项目(XDKJCX20041017)。,心血管康复医学杂志; Chinese Journal of Cardiovascular Rehabilitation Medicine,2005年06期,大鼠; 心脏移植; 模型，动物,目的:改进大鼠腹腔内心脏移植模型。方法:对Ono术式腹腔内心脏移植模型制作进行改进，其法为经升主 动脉用0～4℃乳酸钠林格氏液灌注心脏，供心的升主动脉和肺总动脉分别与受体的腹主动脉及下腔静脉行端侧吻 合。结果:共建立大鼠腹腔内心脏移植模型40例，供心总缺血时间(37±2)min，手术成功率90％，供心跳动时间 平均为10天。结论:模型制作成功的主要因素:(1)供心的低温保护及缺血时间的控制;(2)良好的血管吻合，避 免吻合口漏血及血流不畅;(3)适当的麻醉。
292,晚期肝硬化行肝移植术12例体会,李玉梅; 姚冰; 何明艳; 宁林红; 李国毅; 赵学义,武警山西总队医院外一科; 武警总医院肝移植科; 武警山西总队医院外一科,NA,消化外科; Journal of Digestive Surgery,2006年03期,肝硬化; 肝移植; 预后,NA
239,心肺移植术中对心肺保护的体会,董念国; 孙宗全; 肖诗亮; 刘成硅; 史嘉玮; 刘金平; 徐志娟,华中科技大学同济医学院附属协和医院心血管外科; 华中科技大学同济医学院附属协和医院心血管外科 武汉430022; 武汉430022; 武汉430022,NA,中国胸心血管外科临床杂志; Chinese Journal of Clinical Thoracic and Cardiovascular Surgery,2005年03期,心肺移植; 心肺保护; 先天性心脏病,目的总结室间隔缺损合并艾森门格综合征(Eisenmengersyndrome)患者施行心肺移植术的经验。方法2003年6月25日为1例先天性室间隔缺损合并艾森门格综合征患者施行心肺移植术，采用改良St.Thomas号液保护心肌和Euro-Collins液保护肺。结果术中供者心肺保护良好，术后受者血流动力学稳定，呼吸功能恢复较快，现已生存500d，生活质量良好。结论术中良好的心肺保护、术后防治并发症是提高心肺移植生存率的重要因素。
382,肾移植术后短期留置双J管的疗效观察,董隽; 敖建华; 史立新; 王威; 卢锦山; 肖序仁; 洪宝发,解放军总医院泌尿外科; 解放军总医院泌尿外科 北京; 100853; 北京,NA,临床泌尿外科杂志; Journal of Clinical Urology,2008年04期,肾移植; 输尿管并发症; 支架管,目的:探讨肾移植术短期置放双J管的作用。方法:将142例肾移植患者按留置双J管时间随机均分短期(7天)组与常规(1个月)组，两组患者年龄、性别、以前接受移植的次数、免疫抑制剂的使用、急性肾小管坏死发生率上相似;患者均采用膀胱外输尿管膀胱吻合。结果:两组患者各出现1例输尿管坏死尿瘘，均无输尿管梗阻发生;两组患者泌尿系感染发生率无明显差异。结论:肾移植手术短期留置双J管安全、可靠，与常规留置1个月者疗效无明显差异。
160,心脏移植中经冠脉系统转基因的实验研究,倪一鸣; 冯强; 梁宏立,浙江大学医学院附属第一医院心胸外科浙江省器官移植中心卫生部多器官联合移植重点研究实验室; 浙江大学医学院附属第一医院心胸外科浙江省器官移植中心卫生部多器官联合移植重点研究实验室 310003杭州; 310003杭州,浙江省自然科学基金资助项目(491 0 1 0 -N2 0 0 86),中华器官移植杂志; Chinese Journal of Organ Transplantation,2004年02期,心脏移植; 小鼠，转基因,目的　研究将外源基因转入移植心脏 ，进行基因治疗的可行性。方法　建立小鼠异位心脏移植模型 ，建立经冠脉循环系统灌注技术。将 12只BAIB/c近交系小鼠随机分为转基因组和空白对照组 ，每组各 6只 (供、受者各 3只 )。转基因组经冠脉循环系统将携带报告基因  半乳糖苷酶基因 (Lac Z)的质粒载体 (PSV β gal) /脂质体 (DOSPER)混合物灌注入供心 ，而后进行异位心脏移植 ;对照组则灌注生理盐水。术后 3d获取供心 ，作冰冻切片 ，经X gal组织化学染色检测Lac Z基因的转染和表达情况。结果　转基因组的 3例供心都检测到Lac Z基因的表达 ;其中有 2例Lac Z基因表达位于心室壁中层的心肌内 ，1例其表达位于心内膜下的心肌内。而在对照组则没有检测到Lac Z基因。结论　以冠脉循环系统灌注的方式将质粒载体 /脂质体的混合物灌注入供心 ，使外源基因转入供心并表达是可行的
435,大鼠腹腔内心脏移植模型制作成功关键因素,王约青; 沈承澜; 金庆元,上海中医药大学附属市中医医院普外科,NA,临床和实验医学杂志; Journal of Clinical and Experimental Medicine,2009年02期,心脏移植; 动物模型; 大鼠,目的探讨大鼠心脏异位移植手术操作改良方法及成功的关键因素。方法采用Ono创建的大鼠心脏异位移植模型制作方法，并作部分改良，缩短了手术时间及供心缺血时间。结果预实验30次，成功率36.7%。正式实验100次，成功率达到87.0%，正式实验手术总时间为60±5 min，供心热缺血时间为5±1 min，供心冷缺血时间27±5 min，心脏复跳时间为1.5±1.0 min。结论成功完成实验的关键因素是:严格的动物选择;清洁手术器械;适度的麻醉;缩短供心热缺血时间;准确的吻合技术。
159,再次肝移植五例报告,陈规划; 汪根树; 何晓顺; 朱晓峰; 陆敏强; 杨扬; 蔡常洁; 王国栋,中山大学附属第一医院器官移植中心; 中山大学附属第一医院器官移植中心 510080广州; 510080广州,卫生部临床学科重点项目 ( 2 0 0 132 1) ;广东省医学联合攻关项目 ( 2 0 0 2B30 2 0 7) ;广东省科委攻关项目 ( 99B0 6 70 5G) ;广州市科委基金项目( 2 0 0 1  2   0 4 3  0 1  1),中华器官移植杂志; Chinese Journal of Organ Transplantation,2004年01期,肝移植; 再手术,目的　总结再次肝移植的临床经验。方法　对 5例男性患者施行再次肝移植 ，再次肝移植的原因分别为原发性移植肝无功能 (1例 )、急性排斥反应 (1例 )、慢性排斥反应并胆道感染 (1例 )以及胆道缺血并感染 (2例 )。供肝植入均采用改良背驮式原位肝移植术。术后免疫抑制治疗采用达利珠单抗、甲泼尼龙及他克莫司联合用药 ，必要时加用霉酚酸酯。结果　 3例治愈 ，已分别存活11个月、5个月和 1个月 ，2例分别于术后第 8d、第 10d死亡 ，1例死于多器官感染及功能衰竭 ，1例死于心力衰竭。术后并发症有腹腔出血、多器官感染、胆道感染及切口感染等。结论　再次肝移植是移植肝功能衰竭的有效治疗方法 ，适应证及手术时机的正确把握、围手术期的严密监测和正确处理是提高再次肝移植患者存活率的关键。
196,改良心肌保护液对不同时间热缺血供心移植效果的影响,许慧; 艾登斌; 池一凡; 孙忠东; 侯文明; 杨铁南,青岛大学医学院附属医院麻醉科; 青岛大学医学院附属青岛市立医院麻醉科; 青岛大学医学院附属青岛市立医院心外科; 青岛大学医学院附属青岛市立医院心外科 266003青岛市,青岛市科委资助项目(2001-KNS-2E-51),临床麻醉学杂志; The Journal of Clinical Anaesthesiology,2005年08期,心肌保护液; 热缺血; 器官移植,目的研究对短暂常温热缺血的猪供心采用改良心肌保护液低温保存后对供心结构和功能的保护作用。方法建立猪原位心脏移植模型，分别采用St.Thomas液灌注和改良心肌保护液保存供心。24只家猪随机分为对照组(C组)、5min热缺血组(W1组)、10min热缺血组(W2组)和改良心肌保护液组(E组)。C组，低温灌注后切取供心，4℃保存4h和心脏移植后测定心肌含水率(MWC)、丙二醛(MDA)、三磷酸腺苷(ATP)含量和心脏超微结构观察;W1组，供心灌注低温保护液前常温缺血5min，余同C组;W2组，供心灌注低温保护液前常温缺血10min，余同C组;E组，供心常温缺血5min后用改良保护液灌注和保存，余同C组。均采用标准法移植心脏。心脏移植后观察移植后供心复跳情况、平均动脉压、心排血量(CO)及早期肌钙蛋白I(cTnI)的漏出水平。结果W1和W2组供心低温保存后MWC、MDA高于C组，而ATP明显降低(P<0.05);E组与C组相比，供心低温保存后MWC、MDA增高，ATP减少(P>0.05);超微结构，W1组损伤较C组和E组明显加重，W2组损伤呈不可逆改变。供心移植后，C组和E组cTnI漏出少，血液动力学指标好于W1、W2组(P<0.05)。结论改良心肌保护液可有效改善供心因短暂常温热缺血而造成的结构和功能损害。供心灌注低温保护液前常温缺血10min可造成供心不可逆改变。
11,同种异体原位肝移植2例报告,李立; 张炳彦; 杨达宽; 张捷; 黄青青; 张小文; 冉江华; 唐继红; 李晓延; 李晓; 黄明; 唐晶,昆明医学院第二附属医院肝胆外科!昆明650101; 昆明医学院第二附属医院麻醉科!昆明650101; 昆明医学院第二附属医院胸心血管外科!昆明650101; ?,NA,中国普外基础与临床杂志; CHINESE JOURNAL OF BASES AND CLINCS IN GENERAL SURGERY,2000年02期,原位肝移植; 附属医院; 正位肝移植; 供肝; 昆明医学院,NA
