id_number,title_ch,authors_ch,institutions,funding,journal,journal_issue,keywords_ch,abstract_ch
509,心脏死亡供者肾移植48例临床分析,明英姿; 叶启发; 邵明杰; 佘兴国; 刘洪; 叶少军; 成柯; 赵杰; 万齐全; 马颖; 赵于军; 牛英; 刘炼; 张盛; 朱利军,中南大学湘雅三医院器官移植中心; 武汉大学中南医院,NA,中南大学学报(医学版); Journal of Central South University(Medical Science),2012年06期,肾移植; 心脏死亡器官捐献; 预后,目的:探讨终末期肾病患者接受心脏死亡无偿器官捐献(DCD)供者移植后的恢复情况及此类供体对受者及移植物术后的影响。方法:对48例终末期肾病患者接受DCD捐献的肾脏后行同种异体肾移植术，并对其术前和术后的诊疗及随访血肌酐、移植物及受者存活情况进行回顾性分析。结果:48例受者中无1例出现移植肾原发性无功能(PNF)，18例受者术后出现肾功能延迟恢复(DGF)，其发生率为37.5%，DGF组与无DGF组受者及移植肾生存率比较，差异无统计学意义(分别P=0.098，P=0.447)。48例受者中有7例(14.6%)受者移植肾丢失，其他41例受者随访时间为0.5~23(中位数8)个月，39例(95.1%)受者移植肾功能恢复正常。在1，3，6，12个月移植物的存活率分别为95.7%，93.0%，90.0%，87.5%，患者的存活率分别为100%，94.9%，90.0%，87.5%。结论:在我国尚无脑死亡法的环境下，DCD是解决我国器官移植界瓶颈的重要手段，是器官来源的重要部分，并且有着较好的短中期预后。
310,大鼠供肝冷缺血时间与肝移植术后受者肺损伤的关系,刘昌; 宋宇龙; 刘峰; 王自法; 吕毅,西安交通大学医学院第一医院肝胆外科; 西安交通大学医学院第一医院肝胆外科 710061; 710061,国家自然科学基金资助(30200269),中华器官移植杂志; Chinese Journal of Organ Transplantation,2006年03期,肝移植; 肺; 器官保存; 大鼠,目的探讨大鼠供肝冷保存时间与肝移植术后受者肺损伤的关系。方法用W istar大鼠建立原位肝移植模型，按供肝冷保存时间的不同分为5组(n=10)，A组为假手术组，B组、C组、D组及E组的供肝冷保存时间分别为45 m in、90 m in、120 m in及180 m in。各组大鼠在移植肝恢复血流180 m in后处死，观察肺组织病理学变化，测定肺组织湿干重比值(W/D)、肺组织中髓过氧化氢酶(MPO)的活性，同时检测肝脏流出道血清肿瘤坏死因子(TNF-α)和白细胞介素1β(IL-1β)的水平以及肺组织中TNF-α和IL-1β的表达。结果随着供肝冷保存时间的延长，肝脏流出道血清TNF-α和IL-1β水平及肺组织中TNF-α和IL-1β的表达均逐渐升高，肺组织W/D和MPO活性逐渐增高，肺损伤加重。结论供肝冷缺血时间与肝移植术后受者肺损伤相关，肺损伤随供肝冷缺血时间的延长而加重;血清中TNF-α和IL-1β升高及肺组织中TNF-α和IL-1β表达上调可能与肝移植后的肺损伤有关。
461,肝移植供肝获取和修整的临床研究,林艺雄; 周杰; 林建华; 王宇; 张国伟; 崔忠林; 李湘竑; 谭永法,南方医科大学南方医院肝胆外科,广东省科技计划项目(2007B031514004);南方医院院长基金(2005005),南方医科大学学报; Journal of Southern Medical University,2010年05期,原位肝移植; 器官获取; 器官修整; 供体,目的总结肝移植供肝获取和修整的临床经验。方法分析2004年8月～2007年12月共126例快速肝肾联合获取及105个供肝修整的资料，105个供肝均用于原位肝移植术。结果 126例供肝、肾热缺血时间为1～8.5min，平均4min。肝肾联合切取手术时间19～28min，平均22.5min。105个供肝修整时间38～102min，平均51min;冷缺血时间5.5～13h，平均8h;有8例供肝存在动脉变异。结论供肝获取和修整应强调器官灌注和动脉修整技术，预防供体因素导致的岀血，注意与受体手术组配合。
2,同种原位心脏移植供心的保护,孙国成; 蔡振杰; 刘维永; 万明明; 杨光,第四军医大学西京医院心血管外科中心!陕西西安710033,NA,第四军医大学学报; JOURNAL OF THE FOURTH MILITARY MEDICAL UNIVERSITY,2000年05期,原位心脏移植; 心肌保护,NA
250,供肝切取修整及肝动脉损伤的预防,杨涛; 朱志军; 张雅敏; 蒋文涛; 沈中阳,天津市第一中心医院器官移植中心; 天津市第一中心医院器官移植中心 天津300192; 天津300192,NA,河北医科大学学报; Journal of Hebei Medical University,2006年04期,肝移植; 供肝质量; 肝动脉/损伤,目的探讨供肝切取修整的方法，提高供肝质量和利用率，熟悉肝动脉常见变异，预防供肝切取修整过程中肝动脉损伤。方法回顾性分析2005年1月~2006年4月共计128例供肝切取修整及肝动脉变异资料，供肝采用肝肾联合切取方法，腹主动脉插管灌注，胰腺下肠系膜上静脉外科干插管门静脉灌注。结果采用此方法切取供肝128例，供肝及供肾的灌注及保存良好，其中3例同时完成心脏切取，1例同时完成心肺切取，未发生移植肝原发无功能。发现11例肝动脉变异。切取及修整过程中未出现肝动脉、肾动脉损伤。结论原位腹主动脉插管动脉灌注、肠系膜上静脉外科干处插管可保证供肝、供肾的质量，缩短热缺血时间，降温迅速，灌注充分;可以减少直接对肝十二指肠韧带分离或劈开胰腺组织造成的变异动脉损伤;不影响心、肺、胰腺、脾脏等其它器官同时切取;提示肝动脉变异的少见类型，避免肝动脉损伤的发生。
120,胰肾十二指肠联合移植的围手术期处理,于立新; 刘小友; 邓文锋; 苗芸; 叶桂荣; 李川江,第一军医大学南方医院肾移植科; 第一军医大学南方医院肾移植科 广州510515; 广州510515; 广州510515,全军医学科学技术“十五”计划基金重点项目 (编号 :0 1Z0 49),广东医学; Guangdong Medical Journal,2004年09期,联合移植; 胰; 肾; 围手术期,目的　总结胰肾十二指肠联合移植的围手术期处理经验。方法　回顾性总结 3例胰肾十二指肠联合移植患者的术前准备、手术方法、免疫抑制剂应用和术后并发症防治。结果　 3例手术均获得成功。移植肾功能恢复正常时间 3～ 5d。应用小剂量胰岛素 5～ 10d后完全停用。 1例患者术后 1周出现FK5 0 6肾中毒 ，2例患者出现消化道出血 ，经有效治疗后 ，均痊愈出院。结论　充分的术前准备、细致耐心的操作、娴熟的手术技巧、正确使用免疫抑制剂防治排斥反应、积极预防并处理各种术后并发症是胰肾十二指肠联合移植成功的关键。
282,原位心脏移植治疗终末期心脏病33例,易定华; 俞世强; 王红兵; 刘维永; 张近宝; 刘金成; 程亮; 崔勤,第四军医大学西京医院心血管外科; 第四军医大学西京医院心血管外科 陕西西安710032; 陕西西安710032,NA,中国体外循环杂志; Chinese Journal of Extracorporeal Circulation,2006年04期,心脏移植; 免疫抑制剂; 早期存活率,目的分析总结同种异体原位心脏移植治疗终末期心脏病改善早期存活率的经验。方法2000年1月至2 0 0 6年4月共开展3 3例原位心脏移植术，男性2 9例，女性4例，年龄1 3~5 8(3 8.6 2±8.9 3)岁，体重3 1~86(58.2±10.4)kg。扩张性心肌病23例(其中合并升主动脉瘤1例)，冠心病5例，瓣膜病1例，先天性心脏病1例，克山病3例。其中1例曾行冠状动脉旁路移植术。伴肝肾功能不全6例，左心室射血分数18.2~26.4(21.6±4.2)%。供心热缺血时间为2~7 m in，冷缺血时间为85~137(112±16)m in。33例患者全部进行标准Stanford原位心脏移植术，2003年以前17例于术后即开始应用免疫抑制剂，2003年后16例采用改良的免疫抑制剂应用方法，即于手术前后应用达利珠单抗，于手术后5~6 d才开始应用FK506，维持血浓度谷值为15 ng/L。结果2003年前早期死亡3例，2例分别于术后14 d和38 d死于霉菌感染，1例于术后31 d死于精神抑郁和多脏器衰竭。2003年后16例术后无手术并发症、排斥反应及死亡。1年存活率90.9%。结论终末期心脏病行原位心脏移植的临床疗效良好，免疫抑制剂应用的改良方法可减少手术后早期免疫抑制剂用量，减少感染机会，提高早期存活率。
217,猪供心热缺血移植后对细胞凋亡和Bcl-2、Bax、Fas表达的影响,孙忠东; 池一凡; 杨铁南; 侯文明; 牛兆倬,青岛大学医学院附属青岛市立医院心脏外科; 青岛大学医学院附属青岛市立医院心脏外科 山东青岛266011; 山东青岛266011; 山东青岛266011,青岛市科委资助项目(2001KNS2E51)。,心脏杂志; Chinese Heart Journal,2005年01期,心脏移植; 热缺血; 细胞凋亡; Bcl-2; Bax; Fas,目的:研究供心常温热缺血后细胞凋亡和Bcl2、Bax、Fas蛋白表达的变化。方法:利用猪原位心脏移植实验方法，猪18只随机分为3组，对照组(C，n=6)灌注低温保护液后切取供心，4℃保存4h;热缺血1组(E1，n=6)常温阻断主动脉缺血5min后，灌注低温保护液后切取供心;热缺血2组(E2，n=6)常温阻断主动脉缺血10min后，灌注低温保护液后切取供心。3组低温保存供心4h后分别行原位心脏移植。供心移植2h后取左心室心肌检测心肌细胞凋亡和Bcl2、Bax、Fas蛋白的表达。结果:供心移植2h后，E1、E2组心肌细胞凋亡显著高于C组(P<0.01)，E2组心肌细胞凋亡显著高于E1组(P<0.01)，Bcl2蛋白表达C组高于E1、E2组(P<0.01)，Bax和Fas蛋白表达C组低于E1、E2组(P<0.01)。结论:供心热缺血移植后的心肌细胞凋亡增加，Bcl2、Bax、Fas参与了凋亡发生。
475,单中心2年亲属活体肾移植受者69例优势分析,王强; 李晓利; 蔡明; 石炳毅; 钱叶勇; 李州利; 许亮,解放军第三○九医院泌尿一科; 解放军第三○九医院高干病房,NA,中国组织工程研究与临床康复; Journal of Clinical Rehabilitative Tissue Engineering Research,2010年44期,活体肾移植; 亲属; 受者; 尿毒症; 并发症; 器官移植,背景:国内活体肾移植处于起步阶段，尚缺乏大宗样本的临床资料，为此国内移植专家达成了中国活体供肾移植博鳌会议共识，使活体肾脏移植规范化。目的:回顾性分析单中心亲属活体肾移植受者的临床资料。方法:2006-01/2008-03解放军第三○九医院全军器官移植中心收治的69例亲属肾移植受者，其中父母捐赠给孩子39例，孩子捐赠给父母1例，兄弟姐妹间捐赠19例，三代旁系血清7例，夫妻间捐赠3例;ABO血型相同66例，相容3例;HLA无错配5例，2位点错配者31例，1位点错配者32例，4位点错配者1例;取供者左肾66例，取供者右肾3例，均经开放手术取肾。术后采用环孢素/他克莫司+霉酚酸酯/硫唑嘌呤+泼尼松预防排斥反应。结果与结论:69例受者中，均未发生移植肾失功，1年肾存活率达100%;平均热缺血时间为(3.56±1.42)min，平均冷缺血时间为(45.12±25.34)min，术后肾功能恢复正常时间为(5.6±7.0)d。肾移植后3个月内出现排斥反应9例，肺部感染2例，肾功能延迟恢复3例，肾动脉狭窄1例，骨髓抑制2例，脑梗死1例，尿瘘1例。提示随着活体肾移植供体严格、全面的评估，活体供肾移植具有并发症少、恢复快、排斥发生率低等优势，是目前尿毒症患者家庭自救的主要方式之一。
563,实验脑死状态海马与皮层电活动研究,陈曼娥; 许民辉; 李庭琼; 刘光海; 陆昶昌; 郭素清; 王成英; 陆松敏,第三军医大学第三附属医院神经内科; 第三军医大学第三附属医院二研究室; 第三军医大学第三附属医院二研究室,NA,中国神经精神疾病杂志; Chinese Journal of Nervous and Mental Diseases,1986年03期,海马区; 脑生物电; 等电位; 皮层; 薄壁组织,<正> 近年来脑死状态之所以引起重视，是由于现代医学复苏措施的进步，呼吸器的广泛使用，以及器官移植的需要。而脑死状态可概括为全脑功能不可逆性损害。自60年代初，有关脑死状态判定标准甚多，其内容大同小异，皮层电活动平直消失为其重要指标之一。本实验是在脑死状态下，同时监测海马与皮层电活动变化，并作进一步探讨。鉴于目前尚未见到类似研究，为加强脑缺氧防治，引起临床工作者重视，介绍如下。
545,改良三套管法建立小鼠左肺原位移植模型,乔新伟; 江科; 李劲松; 聂君; 郑志坤; 范凯; 王建军,华中科技大学同济医学院附属协和医院胸外科,国家自然科学基金资助项目(No.81000032);湖北省自然科学基金资助项目(No.2010CDB07903),华中科技大学学报(医学版); Acta Medicinae Universitatis Scientiae et Technologiae Huazhong,2014年02期,小鼠; 肺; 移植; 套管技术,目的探讨采用改良三套管法建立稳定的小鼠左肺原位移植模型。方法取近交系雄性C57BL/6小鼠50只随机分为供体、受体，二者体重相近，采用改良三套管法进行左肺原位移植，术后4周进行显微胸部CT、动脉血气分析及病理学检测。结果该实验行肺移植25例，除1例因肺静脉撕裂致手术失败外，余24例均成功进行移植手术，手术成功率为96%(24/25)。术后1例受体鼠因呼吸道分泌物过多致气道阻塞而死亡，死亡率为4.2%(1/24)。供肺灌注到摘取时间为(6.2±1.8)min，供肺体外套管所需时间(15.0±2.4)min，供、受者完成吻合所需时间为(31.6±5.2)min，冷缺血时间为(32.5±3.5)min，热缺血时间为(31.3±8.9)min，整个手术过程耗时(88.0±12.0)min。术后4周，显微CT检查结果显示，受体鼠移植肺野清晰，膨胀良好;血液气体分析结果显示，阻断右肺门前、后的氧气分压比较，差异无统计学意义(P>0.05);移植肺组织的病理学检查显示，与正常右肺相比，移植左肺结构正常，肺泡通气良好。结论改良后的三套管法是一种简单有效、经济实用的吻合方法，可以成功地建立稳定的小鼠左肺原位移植模型。
380,亲属活体供肾与尸体供肾肾移植临床疗效的比较,曾仲; 马超龙; 况应敏; 崔平; 黄鉴; 刘涛,昆明医学院第一附属医院器官移植中心,NA,昆明医学院学报; Journal of Kunming Medical University,2008年05期,活体; 亲属; 肾移植,目的回顾总结同期完成的活体亲属供肾移植及尸体供肾移植51例的临床经验，分析不同肾脏来源的肾脏移植术后疗效，为开展活体亲属供肾移植提供科学依据.方法收集2002年2月至2008年6月在我院接受活体亲属供肾移植的51例受者、接受尸体供肾移植31例受者的临床资料，对不同肾脏来源受者的性别、年龄、HLA位点配型、手术情况、术中和术后近、远期并发症、免疫抑制方案、肾功能恢复情况及长期随访资料进行对照研究，进一步明确活体亲属供肾移植的临床意义.结果51例活体亲属供肾移植手术均获成功，其中1例术后7个月因骨髓抑制、重症感染自动出院后死亡.人/肾1a存活率为98.07%;尸体供肾移植手术成功，1例因术后5月多囊肾破裂大出血死亡，3例在术后1a内因重症肺部感染死亡，人/肾1a存活率87.10%.结论2种不同来源的肾脏移植在并发症以及人/肾1a存活率等指标上亲属活体供肾移植优于尸体供肾移植.活体亲属供肾移植术前准备充分，配型好，术后并发症少，人/肾存活率高，肾脏来源较为广泛，为肾脏衰竭患者提供了可靠的治疗手段.
607,七例八次背驮式原位肝移植,叶启发; 陈知水; 陈实; 曾凡军; 刘敦贵; 周平; 夏穗生; 裘法祖,同济医科大学附属同济医院,NA,中华器官移植杂志; CHINEAE JOURNAL OF ORGAN TRANSPLANTATION,1998年01期,肝／移植; 肝疾病,对４例Ｗｉｌｓｏｎ病及３例晚期肝病患者施行了８次背驮式原位肝移植术，其中１例为减体积性背驮式原位肝移植。３例已分别存活２年、９个月、６个月，４例死于术后并发症。认为代谢性疾病是原位肝移植的最佳适应证，其次是肝硬变；术后感染、急性和慢性排斥、肺部并发症及胆道并发症是影响患者存活的重要因素；背驮式原位肝移植对全身血流动力学的影响较小。
596,脑死亡的确定,耿稚江,NA,NA,国外医学情报,1999年11期,脑死亡; 病人; 眼脑反射; 前庭眼反射,<正> 数十年来，紧急护理技术的复杂性和进展发展很快。按神经病学标准确定的死亡概念即“脑死亡”的出现已演变成为确定死亡的必不可少的检测方法。在神经病学标准建立以前，对死亡的经典描述是循环和呼吸停止。然而，机械性通气和心血管支持方法的出现对确定那些用上述复杂的技术设备可能维持生命的灾难性脑损伤患者的生命终点提出了新的挑战。
360,大鼠异位心脏移植模型的改进及组织学研究,洪朝; 王电军; 章庆春; 刘建新,中南大学湘雅三医院胸心外科; 广东省心血管病研究所; 中南大学湘雅三医院胸心外科 湖南长沙410013; 湖南长沙410013; 广州510100,NA,中国临床解剖学杂志; Chinese Journal of Clinical Anatomy,2007年05期,鼠; 心脏移植; 模型; 组织学,目的:在Ono模型基础上，建立简单、可靠的大鼠腹腔异位心脏移植模型。方法:以Wister大鼠为供体，SD大鼠为受体，改良建立大鼠腹腔异位心脏移植模型，分为3组:正常Wister大鼠作为对照组;移植后亚急性排斥反应组(术后2周);移植后慢性排斥反应组(术后8周)。分组喂养后按规定时间收获心脏标本进行组织形态学观察。结果:手术成功率为87.5%。其中麻醉过深死亡2例，疑青霉素过敏死亡1例，术中出血过多死亡4例。供心移植吻合时间(24.3±7.6)min，供心冷缺血时间(34.5±8.2)min，腹部触诊移植心脏搏动时间(16.8±7.4)d。组织形态学观察示:移植心脏心肌组织内有大量粒细胞浸润;随着移植后时间延长，CAV逐渐加重，冠脉数量减少，心肌萎缩并心肌纤维化发生。结论:改良Ono模型建立的心脏移植模型具有简单、可靠的优点。收获的移植心脏标本在组织形态学上反映了CAV和心肌纤维化发生、发展的过程，为研究心脏移植后相关疾病提供理想的组织标本。
378,活体肾移植25例临床分析,李剑锋; 鄢业鸿; 肖建生; 单人锋,南昌大学第一附属医院,NA,江西医药; Jiangxi Medical Journal,2008年12期,肾移植; 活体供肾; 尿毒症,目的总结我院25例亲属活体肾移植的临床效果和经验。方法25例亲属活体肾移植，6例非血缘亲属供肾包括5例夫妻和1例岳母供肾，血缘亲属供肾包括15例父母和4例同胞供肾，供体均开放手术取肾，肾脏按常规植于左侧或右侧髂窝，术后采用FK506+MMF+Pred或CsA+MMF+Pred三联免疫抑制治疗，观察术后早期肾功能恢复情况和长期移植肾功能。结果25例供者术后均顺利恢复，无严重并发症，住院日5～12d，平均9.3d，术后肾功能均在正常范围，均恢复正常生活。受者术后均恢复正常肾功能，住院日10～35d，平均13d。8例术后出现急性排斥反应，发生率为32%，均治愈。结论活体亲属肾移植扩大了肾脏来源，供肾冷、热缺血时间短，移植后恢复迅速，远期效果好，是治疗终末期肾病的有效手段，能有效解决供体短缺的问题。
301,快速供肝切取与修整的外科技巧,马毅; 朱晓峰; 何晓顺; 王国栋; 王东平; 胡红星; 钱世鹍; 胡安斌; 鞠卫强; 巫林伟,中山大学附属第一医院器官移植中心; 中山大学附属第一医院器官移植中心 广东广州510080; 广东广州510080,NA,中国实用外科杂志; Chinese Journal of Practical Surgery,2006年02期,肝移植; 供体; 供肝切取技术,目的总结肝脏移植供肝的快速切取和修整经验。方法分析2004年共186例快速供肝的切取和修整的资料。快速切取技术采用原位腹主动脉、肠系膜上静脉灌注附加下腔静脉引流，快速切取供肝，4℃UW液中保存和修整肝脏。结果供肝热缺血时间为3~10min，平均4·5min;冷缺血时间平均为3~16h，平均7h。供肝的修整时间为26~90min，平均46min。供肝修整时发现肝动脉解剖变异20例。结论快速供肝切取法要求术者技术娴熟、动作迅速和准确，可最大限度地减少供肝热缺血时间。快速切取法能保证供肝的质量和确保供肝切取的成功。
185,25例原位肝移植的临床总结,张启瑜; 虞冠锋; 廖毅; 吴存造; 郑少玲; 周蒙滔; 杨亦荣; 余正平; 沈龙捷; 屠金夫; 陈宗静; 夏鹏; 陈文伟,温州医学院第一附属医院移植科; 温州医学院第一附属医院移植科 浙江温州325027; 浙江温州325027; 浙江温州325027,NA,肝胆胰外科杂志; Journal of Hepatopancreatobiliary Surgery,2005年02期,肝移植; 适应证; 肝细胞肝癌; 乙型肝炎; 手术方式; 并发症,目的总结肝脏移植治疗不同终末期肝病的经验。方法对23例原位肝移植与2例肝、肾联合移植的临床资料进行回顾性分析。手术方式均采用同种异体原位肝移植，包括经典原位，经典背驮及改良背驮式。结果全组死亡7例，存活18例。术后发生排斥反应、感染及脑血管意外等并发症。术后服用拉米呋啶的20例乙型肝炎患者3例复发。结论开展肝移植的初期应严格掌握适应证，选择条件较好的受者;术式的改进及围手术期的严密监测与正确处理、并发症的防治是肝移植成功的重要条件。
20,心脏移植治疗终末期扩张性心肌病的体会,成杞润; 姚建民; 贾清仁; 牛建立; 张笑萌; 马凤霞,北京军区总医院; 北京军区总医院 北京; 100700; 北京; 100700,NA,北京军区医药,2001年03期,心肌病; 充血性; 心脏移植; 免疫抑制剂,<正>2000年9月我院为1例终末期扩张性心肌病患者实施了原位心脏移植手术，患者术后恢复顺利，至今存活已3个月，无并发症，现就围手术期处理体会报告如下。1 临床资料1.1 一般资料1.1.1 受体情况:男，51岁，体重58kg。发现心脏增大5年，轻微活动后心慌、气短1年，劳动力丧失，曾有2次急性左心衰竭史，多次住院治疗病情改善不明显。查体:体温36.5℃，血压108/52mmHg。全身皮肤粘膜无黄染、紫绀，无颈静脉怒张，双肺呼吸音清晰，无干湿性罗音;心界向左侧明显扩大，心率108/min，律齐，心
422,改善的心脏移植术前准备方法对已停跳供心心肌的保护作用,杨国锋; 陈道中; 陈良万; 黄雪珊; 吴锡阶,福建医科大学附属协和医院心外科,NA,福建医科大学学报; Journal of Fujian Medical University,2009年03期,心脏移植; 移植，同种; 保存，生物学; 心肌,目的探讨已停跳供心的原位心脏移植术前准备对已停跳供心心肌保护的作用。方法用已停跳供心为47例终末期心脏病患者实施了原位心脏移植，术前进行充分的准备。心肌保护液均使用HTK液，灌注总量按供体体质量计算，为30～50mL/kg。首先采用8℃的HTK液1000mL直接灌注心脏，供心切下后，放到套有无菌塑料袋的无菌器皿中，再将剩余量的4℃的HTK液灌完，流出的HTK液可用来浸泡供心。结果所有已停跳供心均在移入后恢复泵功能，移植后未发生与心功能相关性并发症。结论充分的术前准备及良好的心肌保护是已停跳供心的原位心脏移植获得成功的关键。
576,高龄肾移植术后并发症的防治,练英莲; 王艳,第一军医大学南方医院泌尿外科!广州市510515,NA,中华护理杂志; Chinese Journal of Nursing,1994年03期,并发症; 并发病; 疾病; 高龄; 脑血管意外; 高龄患者; 尿毒症患者; 尿路感染; 肾移植术,报告自1978年4月至1992年1月对50岁以上尿毒症患者行肾移植术60例，术后发生并发症36例，占60％。除术后排异反应外，主要并发症有急性肾小管坏死、心衰、脑血管意外、感染等。作者以为对高龄肾移植患者应注意①了解患者的原发疾病；②注意高龄患者生命体征的特殊变化；③准确记录尿量；④加强患者的基础护理。
496,肾移植后尿路并发症的临床处理,曾斌元,湖南省邵阳市第一人民医院,NA,中国当代医药; China Modern Medicine,2011年11期,肾移植; 尿路并发症; 临床处理,目的:探索肾移植尿路并发症的发生与治疗情况。方法:总结并分析36例肾脏移植后尿路并发症患者，主要采取抗生素治疗尿路并发症。结果:36例肾移植后并发症患者所患的疾病分别为，尿路感染15例，肺炎11例，上呼吸道感染4例，伤口感染3例，消化道感染2例，腹腔感染1例。在治疗中，除1例肺部感染患者死亡，2例尿路感染患者有所好转外，其余均已治愈。结论:根据不同症状采用适宜的处理方法，及时治疗尿路并发症。
