id_number,title_ch,authors_ch,institutions,funding,journal,journal_issue,keywords_ch,abstract_ch
649,低血压灌注对无心跳大鼠肺支气管肺泡灌洗液中不同白细胞及HMGB1的影响,张航; 韩敬泉; 夏恩迪; 崔键; 曹守强; 赵桂彬; 张凯; 刘成; 张翔宇,哈尔滨医科大学附属第四医院胸外科,哈尔滨市科技局基金项目(RC2011XK004053);黑龙江省科技厅应用技术研究与开发计划项目(GA14C101),现代生物医学进展; Progress in Modern Biomedicine,2016年24期,无心跳供体; 白细胞; HMGB1; 肺泡灌洗液,目的:研究低血压灌注对无心跳大鼠肺支气管肺泡灌洗液中不同白细胞及HMGB1的影响。方法:将32只180-200g SD雄性大鼠随机分成对照组[sham]、缺血30min组[30I]、缺血60 min组[60I]和缺血90 min组[90I](n=8)，4组大鼠分别接受麻醉后持续机械通气，测定并统计各组支气管肺泡灌洗液中总白细胞计数及不同白细胞计数，免疫印迹法检测支气管肺泡灌洗液中HMGB1蛋白的表达。结果:总白细胞、巨噬细胞、淋巴细胞计数及HMGB1蛋白表达均随着低血压灌注时间的延长而逐渐增加，尤其在[60I]和[90I]两组，灌洗液中巨噬细胞和淋巴细胞计数有显著增高，并且巨噬细胞和淋巴细胞与HMGB1蛋白表达呈正相关。结论:本研究证实HMGB1蛋白表达和巨噬细胞，淋巴细胞计数在低血压灌注缺血期内升高，提示HMGB1蛋白可能具有驱动炎症反应的作用。
172,心脏移植供心的保护,黄小蝶; 叶晓青,广东深圳市孙逸仙心血管医院麻醉科; 广东深圳市孙逸仙心血管医院麻醉科 518001; 518001,NA,中国基层医药; Chinese Journal of Primary Medicine Pharmacy,2004年08期,心脏移植; 心肌保护,目的　总结同种异体心脏移植供心保护经验。方法　 4例终末期扩张性心脏病心脏移植手术。供心缺血期间采用 4℃改良St .Thomas液顺行灌注快速心脏停搏 ，供心取出后冷生理盐水冲洗心腔 ，继之用4℃UW液 (universityofwisconsinsolution) 10 0 0ml经升主动脉根部单次灌注 ，然后 4℃生理盐水浸泡保存 ，供心运输、移植过程不再行心肌保护液灌注。供心热缺血时间 1～ 3min ，冷缺血时间 110～ 180min(平均 14 2  5± 2 9 0min)。结果　心脏移植完毕开放升主动脉后 4例心脏全部自动复跳 ，辅助循环 34～ 5 4min(平均 4 2  8± 9 8min)。术后心功能恢复良好 ，未出现低心输出量综合征 ，术后 1个月左心室射血分数 (LVEF)恢复到6 0 %～ 6 5 %。 3例存活至今 ，1例术后 5个月因自行停用抗免疫药死于急性排异反应。结论　冷晶体停跳液灌注心脏快速停跳 ，继之 4℃UW液单次灌注结合 4℃生理盐水浸泡保存供心 ，方法简便 ，效果良好 ，供心冷缺血时间可达 3h。
668,小鼠颈部心脏移植模型的建立,曹健斌; 龚勇泉; 韦成信; 李富骊; 罗鹏,柳州市人民医院心胸血管外科,广西自然科学基金回国基金项目(2015GXNSFCA139013),中国胸心血管外科临床杂志; Chinese Journal of Clinical Thoracic and Cardiovascular Surgery,2017年11期,心脏移植; 动物模型; 小鼠,目的探讨如何建立稳定的小鼠颈部心脏移植模型。方法将40只雄性C57小鼠，周龄约6~8周，体质量19~24 g，随机分成供体和受体，每组20只。供体心脏升主动脉与受体右侧颈总动脉端侧吻合，供体心脏肺动脉与受体右侧颈外静脉对端吻合，建立颈部心脏移植模型。结果手术成功率在95%以上，冷缺血时间(15±5)min，热缺血时间(23±6)min，手术时间(55±15)min，术后移植心脏存活达到30 d以上，术后1个月移植心脏病理检查和正常心脏无明显差异。结论小鼠颈部心脏移植模型稳定可靠，通过直视和触诊可以方便监测供体心脏的存活，有利于开展移植方面的基础研究。
657,胆道闭锁肝移植术后早期肝动脉血栓的诊断及处理,韩环立; 张明满; 郭春宝; 康权; 李英存; 蒲从伦,重庆医科大学附属儿童医院肝胆外科,国家临床重点专科建设项目资助(编号[2013]544),临床小儿外科杂志; Journal of Clinical Pediatric Surgery,2017年02期,胆道闭锁; 肝移植; 肝动脉血栓; 手术后并发症; 儿童,目的探讨胆道闭锁肝移植术后早期肝动脉血栓(hepatic arterythrombosis，HAT)的诊断、治疗以及对预后的影响。方法回顾性分析本院2006年6月至2014年4月间完成的41例胆道闭锁肝移植手术临床资料，术后早期常规监测血生化指标、彩色多普勒超声监测肝动脉血流，对疑有肝动脉血栓形成患者，行肝动脉造影或开腹肝动脉探查。结果术后9例发生早期肝动脉血栓，发生率21.95%，经肝动脉介入溶栓、肝动脉切开取栓或再次肝移植，2例死于肝动脉血栓，7例肝动脉再通，但围手术期2例死于肺部肺炎克雷白杆菌感染，1例死于肠漏后感染性休克，1例死于毛细血管渗漏综合征，1例再次肝移植者因原发肝无功能而死亡。结论胆道闭锁肝移植术后早期肝动脉血栓发生率较高，也是导致死亡的重要原因之一，对于可疑HAT者，尽早行肝动脉造影确诊及溶栓治疗、开腹探查肝动脉切开取栓治疗可有效诊断和治疗HAT。
175,热休克蛋白70对大鼠心脏停搏供体肝移植的保护作用,赵雪松; 董春钰; 杨志明; 赵继学; 张学颖,吉林大学第一医院儿外科; 吉林大学第一医院儿外科 吉林长春130021; 吉林长春130021; 吉林长春130021,吉林省计委科技攻关项目资助课题 (1997- 6 5 ),吉林大学学报(医学版); Journal of Jilin University of (Medicine Edition),2005年03期,热休克蛋白70; 心脏停搏，人工; 肝移植,目的:采用心脏停搏供体大鼠原位肝移植模型，观察热休克蛋白70 (HSP70 )对心脏停搏后不同时间的供肝缺血再灌注损伤的影响。方法:以缺血预处理方法诱导大鼠肝脏组织产生HSP70 ，以预处理(IP)与否及供体心脏停搏4 5 m in或6 0 min的不同，将供体大鼠分为4组(IP- 4 5 ，IP- 6 0 ，C- 4 5和C- 6 0 )。于肝移植术后1h采血检测肝功能，术后1h及7d切取肝脏，观察肝脏病理学改变，并观察各组大鼠术后存活时间。结果:缺血预处理后2 4～4 8h，肝组织HSP70表达明显增强;肝移植术后1h，血清AL T和AST水平IP组明显低于对照(C)组(P<0 .0 5 ) ;术后7d，IP组移植肝光学显微镜下肝小叶结构完好，汇管区有少量淋巴细胞浸润，C组移植肝则出现了较多的肝细胞坏死和气球样变。C- 4 5和C- 6 0组1周存活率分别为12 .5 %和0 ;而IP- 4 5和IP- 6 0组1周存活率分别为6 2 .5 %和37.5 %。结论:HSP70明显改善术后肝脏功能和减轻肝脏病理学改变，显著提高心脏停搏供体肝移植的存活率，HSP70对心脏停搏供体肝移植缺血再灌注损伤具有明显保护作用。
500,胸腹部多器官联合切取技术方法探讨,刘小友; 徐健; 杜传福; 邓文峰; 王亦斌; 付绍杰; 余玉明; 魏强; 苗芸; 李川江; 叶俊生; 于立新,南方医科大学珠江医院器官移植科; 南方医科大学南方医院器官移植科,广东高校优秀青年创新人才培养计划项目(LYM09041);广东省自然科学博士启动基金(06301161),中国临床解剖学杂志; Chinese Journal of Clinical Anatomy,2011年04期,胸部器官; 腹部器官; 多器官联合切取; 器官移植,"目的探讨胸腹部多器官联合切取的技术方法及其对获取的器官质量的影响。方法采取胸部U型切口联合腹部大""十""切口，分别建立胸部器官和腹部器官原位灌注，在灌注的同时进行多器官游离和切取。结果 2003年至今采用此方法行胸、腹腔多器官联合切取术8次，获得供心、肝、胰各8个，供肺8对及供肾16个。热缺血时间为(2±1.2)min，器官切取时间约(20±3)min。未出现任何影响器官质量和功能的手术意外损伤。临床行心脏移植6例、心肺联合移植2例、双肺移植3例、单肺移植5例、肝移植6例、肝肾联合移植2例、胰肾联合移植3例、肾移植11例，所有移植器官均在术后立即发挥功能。结论采用胸腹部多器官联合切取的技术方法能够快速优质的获取胸部和腹部供器官，缩短热缺血时间，减少手术损伤，提高供器官的质量和数量。"
209,猪供心不同时间热缺血移植后细胞凋亡的变化,孙忠东; 池一凡; 杨铁南; 侯文明; 牛兆倬,青岛大学医学院附属青岛市立医院心脏外科; 青岛大学医学院附属青岛市立医院心脏外科 山东青岛266011; 山东青岛266011; 山东青岛266011,青岛市科委资助项目(2001KNS-2E-51),中国体外循环杂志; Chinese Journal of Extracorporeal Circulation,2005年02期,心脏移植; 热缺血; 细胞凋亡,目的研究供心常温不同时间热缺血后细胞凋亡的变化。方法利用猪原位心脏移植实施方法，18只猪随机分为3组，对照组(C，n=6)灌注低温保护液后切取供心，4℃保存4h;热缺血1组(E1，n=6)常温阻断主动脉缺血5min后灌注低温保护液后切取供心;热缺血2组(E2，n=6)常温阻断主动脉缺血10min后，灌注低温保护液后切取供心。三组低温保存供心4h后分别行原位心脏移植。供心移植2h后取左心室心肌检测心肌细胞凋亡的变化。结果供心移植2h后，E1、E2组心肌细胞凋亡明显高于C组(P<0.01)，E2组心肌细胞凋亡明显高于El组(P<0.01)。结论供心热缺血时间的延长增加移植后的心肌细胞凋亡的发生。
198,肾移植301例次报告,赖永通; 张峻; 曹文锋; 黄伟佳; 高兴成,广州市第二人民医院肾移植科; 广州市第二人民医院肾移植科 广东广州510150; 广东广州510150; 广东广州510150,NA,现代泌尿外科杂志; Journal of Modern Urology,2005年02期,肾移植; 综合分析,目的　总结肾移植的临床经验。方法　回顾性分析301例次肾移植患者的临床资料，从人和(或)肾存活率，肾移植术前准备、供肾及移植情况、术后并发症及处理、免疫抑制剂的应用、HLA配型及群体反应性抗体(PRA)检测等方面对移植肾效果影响进行分析总结。结果　1、3、5 年人/肾存活率分别为 96%/91% (243/254)/(230/254)， 81%/76% (114/143)/(107/143)和68%/56%(38/57)/(32/57)。67例发生1~2次急性排斥反应，其中PRA致敏受者急性排斥反应发生率高达 48.57%。术后并发移植肾功能延迟恢复(DGF)48例;各种感染40例;急性左心衰竭12例。结论　充分的术前准备是安全度过围手术期的关键;良好的供肾和组织配型、术后免疫抑制剂的合理应用、并发症的预防和及时治疗，是提高肾移植术后人、肾存活率的重要保证。
512,甘氨酸对大鼠供肝热缺血再灌注损伤的保护作用,顾捷; 白慧茹; 崔春霞; 孙文娟,内蒙古医学院基础医学院法医教研室,NA,内蒙古医学院学报; Journal of Inner Mongolia Medical College; 2012年S4期,NA,肝脏移植; 缺血; 再灌注损伤; 甘氨酸; 预处理,<正>肝移植早期并发移植肝术后无功能(Primarynonfunction，PNF)的发生率为2%～23%，其发生原因与移植肝组织缺血缺氧-再灌注损伤有极为密切的关系。再灌注损伤对移植肝功能的损害，具有现实意义。甘氨酸是人体内的一种非必需氨基酸，它在保护心、肝、肺的缺血再灌注损伤(ischemical reperfusion injury，IRI)中起重要作
72,大鼠异位心脏移植术围术期并发症的原因和处理,黄瑞健; 孙培吾; 强华; 陈良万; 林乌拉; 苏东辉; 林峰,福建医科大学附属第一医院心胸外科; 中山大学附属第一医院心胸外科; 福建医科大学病原生物学系; 福建医科大学附属协和医院心外科、福建省心胸外科研究所; 福建医科大学附属协和医院心外科、福建省心胸外科研究所 福州350005; 广州510080; 福州350004; 福州350001; 福州350005; 福州350001,福建省自然科学基金资助项目 ( C0 0 10 0 10 ),福建医科大学学报; Journal of Fujian Medical University,2003年01期,心脏移植; 手术中并发症; 大鼠,目的　对大鼠异位心脏移植术的围术期并发症的产生原因和处理方法进行初步总结。　方法　运用显微缝合技术对 96只大鼠进行心脏移植术 ，其中颈部移植法 5 6只 ，腹部移植法 4 0只。　结果　手术成功率 4 2 % ，围术期并发症发生率 5 8% ，主要为麻醉意外、术中大出血、供心保护不佳致复跳困难、静脉回流不良、脊神经损伤等。　结论　对术中大出血和供心保护不佳的有效预防与处理将有助于提高心脏移植术的成功率
87,原位心脏移植的体外循环管理,肖立琼; 刘家琴; 徐明,南京医科大学附属南京市第一医院心研所; 南京医科大学附属南京市第一医院心研所 南京; 210006; 南京; 210006,NA,江西医药; Jiangxi Medical Journal,2003年02期,体外循环; 心脏外科手术; 心脏移植; 冷晶体停跳液,<正> 我院于2001年8月～2002年10月在体外循环下先后进行了4例原位心脏移植术，4例均获成功。现将体外循环的特点及处理报告如下:1 临床资料 4例受体中，1例为女性，3例为男性，年龄分别为51、26、62、65岁，体重分别为41、108、75、70Kg，
666,器官捐献过程中供体采集的手术配合,杨俊婷,天津市第一中心医院手术室,NA,中国城乡企业卫生; Chinese Journal of Urban and Rural Enterprise Hygiene,2017年02期,心脏死亡器官捐献; 供体采集; 手术配合,目的心脏死亡器官捐献(Donation after Cardiac Death，DCD)是指公民在心脏死亡后进行的器官捐献，以往也称无心跳捐献(Non Heart-Beating Donation，NHBD)。总结DCD实施供体采集的手术配合体会。方法回顾天津市第一中心医院选取的50例供体器官获取的DCD手术的临床资料，总结供体采集手术过程，主要以分离、切取、灌注、修整等步骤进行。通过与医生密切配合完成供体的采集和灌注工作。结果供体采集完好，正常供给受体移植。结论供体的选择和采集方法与手术室护士熟练、高质量的手术配合均可有效缩短供体器官的冷、热缺血时间，对DCD器官移植手术成功起到关键作用，而良好的手术配合以及管理有助于提高后期器官移植手术的成功率。
135,腔静脉成形改良背驮式肝移植1例报告,王爱坤; 葛苏扬; 王立胜; 浦立勇; 吉林; 李青荷; 王学浩,东南大学医学院附属盐城医院普外科; 东南大学医学院附属盐城医院麻醉科; 南京医科大学第一附属医院江苏省肝脏移植中心 江苏盐城224001; 江苏盐城224001; 1江苏盐城224001; 江苏南京210029,NA,南京医科大学学报(自然科学版); Acta Academiae Medicinae Nanjing,2004年01期,腔静脉成形; 肝移植; 肝肿瘤; 门静脉高压,NA
164,大白鼠无心跳供体肺移植模型的建立,廖东山; 廖崇先; 李增棋,福建医大附属协和医院福建省胸心外科研究所心外科; 福建医大附属协和医院福建省胸心外科研究所心外科 350001福州; 350001福州,NA,中华实验外科杂志; Chinese Journal of Experimental Surgery,2004年06期,大鼠; 肺; 移植; 模型，动物,目的　建立无心跳供体肺移植的模型 ，探讨无心跳供体肺应用于肺移植的可能性。方法　 60只健康SD大白鼠 ，随机分成 3组 :1组为有心跳供体组 ;2组为无心跳供体  热缺血 3 0min组 ;3组为无心跳供体  热缺血 60min组。供肺置于 4℃低钾右旋糖苷 (LPD)液中 4h。受体鼠行左侧开胸术和原位左肺移植术。术后维持辅助呼吸 1h ，阻断右肺门。结果　 2组与 1组相比 ，受体存活时间、移植后肺顺应性、超微结构、粒细胞浸润、气体交换等指标的差异均无显著性 (P >0 .0 5 )。3组与 1、2组相比差异有显著性 (P <0 .0 5 )。结论　成功建立了无心跳供体肺移植的实验模型 ，采用无心跳供体肺是肺移植一种安全而有效的方法。热缺血 3 0min大白鼠无心跳供体肺适于肺移植
452,不同热缺血时间的无心跳供肝在肝移植中应用的疗效评价,鞠卫强; 何晓顺; 韩明; 邰强; 巫林伟; 马毅; 王东平; 朱晓峰; 黄洁夫,中山大学附属第一医院器官移植中心,广东省自然科学基金资助项目(06104600),中国普通外科杂志; Chinese Journal of General Surgery,2009年01期,肝移植; 无心跳供体; 热缺血; 冷保存,目的探讨不同热缺血时间的无心跳供肝在临床肝移植中应用的疗效。方法回顾性分析142例冷保存时间在12h之内的不同热缺血时间的无心跳供肝肝移植患者的临床资料，根据热缺血时间分为3组:Ⅰ组为5 min之内，43例;Ⅱ组为5~10 min，77例;Ⅲ组为10~15 min，22例。比较3组间肝移植术后谷丙转氨酶(ALT)峰值、原发性移植肝无功能、急性排斥反应、胆道并发症、血管并发症、感染以及移植肝存活和受体存活的差异。结果3组患者术后均未发生原发性移植肝无功能。Ⅱ组术后ALT峰值及感染发生率显著高于Ⅰ组;而Ⅲ组术后ALT峰值、胆道并发症发生率、血管并发症发生率及感染发生率均显著升高。随访8~32个月。Ⅲ组移植肝存活率及受体存活率均降低，与Ⅰ组和Ⅱ组比较，差异均有统计学意义。结论冷保存时间在12 h之内的无心跳供肝能耐受热缺血的安全时限为10 min;热缺血时间大于10 min的供肝，移植术后相关并发症发生率显著增加，移植肝和受体存活率显著降低。
359,供体肝缺氧时间对肝移植大鼠生存率的影响,王懋莉; 李斌; 张培建; 梁四海; 金成; 李勇; 周斌,扬州大学第二临床医学院普通外科研究室; 扬州大学第二临床医学院普通外科研究室 江苏扬州225001; 江苏扬州225001,江苏省科技厅社会发展科技计划项目(BS2005038);扬州市科技局社会发展计划项目(YZ2004048),江苏大学学报(医学版); Journal of Jiangsu University(Medicine Edition),2007年04期,缺氧; 肝移植; 热缺血; 存活率,目的:研究肝移植围手术期的缺氧损伤对肝移植大鼠生存率的影响。方法:SD大鼠随机分为4组，对照组:不进行低氧处理的原位肝移植组;A组:50只，供肝大鼠先进行10 min的低氧适应后在低氧处置下按传统的Ka-mada法行供肝切取;B组:40只，低氧处置同A组，但供肝切取按改进的取肝法，即不过度游离肝动脉，于灌肝后离断肝动脉。C组:15只，假手术组。观测各组大鼠手术后24 h和1 w的生存率。结果:在低氧条件下，采用改进的快速取肝法手术的B组与采用常规的Kamada取肝法的A组大鼠相比，B组大鼠供肝切取时间显著缩短，一周生存率明显提高，但仍低于对照组的一周生存率。结论:肝移植大鼠一周存活率与供肝的实际热缺血时间呈负相关。肝移植围手术期中各种因素引起的肝脏缺氧是导致供肝实际热缺血损伤的主要原因。
128,肝移植供肝切取与修整技术,吕立志; 胡还章; 江艺; 杨芳; 张绍庚; 林华,南京军区福州总医院肝胆外科; 南京军区福州总医院肝胆外科 福建福州350025; 福建福州350025; 福建福州350025,NA,解剖与临床; Anatomy and Clinics,2004年04期,肝移植; 器官获取; 供体,目的 :总结临床肝移植供肝切取与修整技术。方法 :采用原位腹主动脉、门静脉双路灌注及肝肾联合快速切取法切取供肝及肾 4 0例次 ，并施行同种异体肝移植 4 0例 ，其中 3例行肝肾联合移植。结果 :全组供肝平均热缺血时间为 4min ，切取时间为 2 5min ，保存时间为 6h。全组移植肝均于恢复血流 10min内有金黄色胆汁泌出 ，1周左右肝功能恢复正常。结论 :我院开展的供肝、肾的切取与修整技术在临床实际应用中取得满意的效果 ，为移植手术的成功提供了可靠的保证。
459,益生注射液抗大鼠移植心缺血再灌注损伤的实验研究,李明; 严律南,重庆医科大学附属第一医院普外科; 四川大学华西医院普外科,NA,重庆医学; Chongqing Medicine,2010年23期,益生注射液; 缺血再灌注损伤; 大鼠; 心脏移植,目的探讨中药益生注射液对大鼠移植心缺血再灌注损伤的保护作用。方法采用封闭群SD大鼠20只，随机分为两组，对照组的离体心脏用4℃生理盐水保存3 h后，行心脏移植，术后不给任何药物处理;实验组的离体心脏则用含益生注射液的4℃生理盐水保存3 h后，行心脏移植，术后每天腹腔注射益生注射液，剂量为8 mg/kg，连续9 d。分别采集受体术前和术后1、3、5、7、9d血液，检测丙二醛(MDA)含量和超氧化物歧化酶(SOD)活性。结果对照组与实验组相比，术前两组血浆的MDA含量和SOD活性相似;术后第1天，对照组血浆MDA含量升高，并明显高于实验组(P<0.05)，而SOD活性下降，并明显低于实验组(P<0.05);此后，两组的血浆MDA含量和SOD活性逐渐恢复到正常，但实验组恢复较快。结论益生注射液对大鼠移植心缺血再灌注损伤有保护作用。
483,尸体供者小肠、肝和肾脏器联合切取及保存技术,李元新; 李幼生; 李民,南京军区南京总医院普通外科研究所,国家科技支撑计划项目(2008BAI60B06),中华移植杂志(电子版); Chinese Journal of Transplantation(Electronic Edition),2010年04期,器官切取; 器官保存; 小肠移植; 肝移植; 肾移植; 胰腺移植,目的建立尸体供者全腹腔脏器切取和保存技术，同时为不同的小肠移植、肝移植和肾移植受者提供供器官。方法共进行8次同一尸体供者的全腹腔脏器切取手术。供体切取经腹主动脉与肠系膜下静脉插管，高渗枸橼酸-腺苷肾保存液及UniversityofWisconsin液原位灌注，肝、小肠、胰腺、脾、肾整块切取。供器官经后台修整后，分别成为肝、小肠和肾移植物进行相应的受者移植手术。结果 8次供者腹腔脏器切取和后台修整手术共获取8具小肠移植物、8具肝移植物和16具肾移植物。利用所修整出的供器官成功地完成5次单独小肠移植、8次肝移植和16次肾移植，术后移植物功能良好。结论所建立的尸体供者全腹腔脏器切取和保存技术，可同时为不同的小肠移植、肝移植和肾移植受者提供供器官;借鉴美国匹兹堡大学的供者器官后台分离技术，还可同时为胰腺移植受者提供供器官。
187,原位背驼式肝移植围手术期并发症的处理,苟欣; 秦建国; 张翔; 胡韵; 王槐志; 杨占宇,贵阳医学院黄河医院肝胆外科; 贵阳医学院附属医院肝胆外科; 第三军医大学西南医院肝胆外科; 第三军医大学西南医院肝胆外科 550009; 550009; 550004; 400038; 400038,NA,贵州医药; Guizhou Medical Journal,2005年03期,肝移植; 围手术期; 并发症,目的总结临床肝移植围手术期并发症处理的经验。方法对12例成人原位背驼式肝移植临床资料进行回顾性分析。结果12例患者手术成功率100%;围手术期存活率75%;术后围手术期共发生并发症15例次。结论完善的手术技术、围手术期的严密监测及并发症防治与正确处理是肝移植成功的必要条件。
169,同种异体心肺联合移植1例,刘中民; 范慧敏; 刘泳; 卢蓉; 郭建华,同济大学附属东方医院胸心外科; 同济大学附属东方医院胸心外科 200120上海; 200120上海,NA,中华胸心血管外科杂志; Chinese Journal of Thoracic and Cardiovascular Surgery,2004年02期,心肺移植; 同种移植,目的　报告 1例同种异体心肺联合移植术病例。方法　 2 0 0 3年 7月 1例先天性心脏病、房间隔缺损合并Eisenmenger综合征女病人在全麻、中低温、全心肺转流下进行同种异体心肺联合移植术。结果　手术顺利 ，心脏自动复跳 ，血流动力学平稳。无出血、感染和急性排异反应 ，术后 1h清醒 ，36h拔除气管插管。第 3d下床活动。术后 30d病人一般情况良好 ，各项生命指征正常 ，可在隔离病房内自由活动 ，术后 5 0d转普通病房。现已健康生存半年余 ，病人状况良好。结论　选择合适的供、受体 ，加强心肺保存 ，以及重视围术期处理 ，同种异体心肺联合移植可以挽救终末期心肺疾患病人的生命。
76,肾移植术后尿瘘的原因及处理,范礼佩; 赵明; 黄先恩,第一军医大学珠江医院器官移植科; 第一军医大学珠江医院器官移植科 广州510282; 广州510282; 广州510282,NA,广东医学; Guangdong Medical Journal,2003年01期,尿瘘; 患者; 膀胱黏膜; 手术探查; 肾移植术后; 输尿管; 泌尿生殖系统,NA
